,facility_title,link,settlement,facility_type,facility_type_eng,address,website,latitude,longitude
2652,Хвоенская амбулатория общей практики,https://healthcare.by/instinfo.php?orgnum=4999,Хвоенск,Амбулатория,Outpatient Clinic,"ул. Железнодорожная, 21, 247993, пос. Хвоенск, Житковичский р-н, Гомельская обл.",,52.0499725,27.9260488
2653,Хидринская амбулатория врача общей практики,https://healthcare.by/instinfo.php?orgnum=11624,Хидры,Амбулатория,Outpatient Clinic,"ул. Ленина, 7, 225869, д. Хидры, Кобринский р-н, Брестская обл.",,52.1472257,24.3737841
2654,Хмелевская амбулатория врача общей практики,https://healthcare.by/instinfo.php?orgnum=17781,Хмелево,Амбулатория,Outpatient Clinic,"ул. Центральная, 41, 225127, д. Хмелево, Жабинковский р-н, Брестская обл.",,52.2526284,23.907748
2655,Ходосовская амбулатория врача общей практики,https://healthcare.by/instinfo.php?orgnum=13185,Ходосы,Амбулатория,Outpatient Clinic,"213460, д. Ходосы, Мстиславский р-н, Могилевская обл.",,53.9307089,31.4767874
2656,Холмянская амбулатория врача общей практики,https://healthcare.by/instinfo.php?orgnum=16366,Холмы,Амбулатория,Outpatient Clinic,"213570, д. Холмы, Краснопольский р-н, Могилевская обл.",,53.3275526,31.3726791
2657,Холхолицкая амбулатория,https://healthcare.by/instinfo.php?orgnum=6183,Холхолица,Амбулатория,Outpatient Clinic,"ул. 60 лет Октября, 39, 222145, д. Холхолица, Борисовский р-н, Минская обл.",,54.429421,28.430376
2658,Хомская амбулатория общей практики,https://healthcare.by/instinfo.php?orgnum=17746,Хомск,Амбулатория,Outpatient Clinic,"ул. Советская, 3, 225620, д. Хомск, Дрогичинский р-н, Брестская обл.",,52.3328282,25.2119493
2659,Хоневичская врачебная амбулатория,https://healthcare.by/instinfo.php?orgnum=13921,Хоневичи,Амбулатория,Outpatient Clinic,"231985, д. Хоневичи, Свислочский р-н, Гродненская обл.",,52.8791749,24.55221
2660,Хоревская амбулатория общей практики,https://healthcare.by/instinfo.php?orgnum=17360,Хорева,Амбулатория,Outpatient Clinic,"ул. Ленина, 41, 225145, д. Хорева, Пружанский р-н, Брестская обл.",,52.71012409999999,25.3387982
2661,Хоростовская амбулатория,https://healthcare.by/instinfo.php?orgnum=13637,Хоростово,Амбулатория,Outpatient Clinic,"ул. Коржа, 5, 223734, д. Хоростово, Солигорский р-н, Минская обл.",,52.4987591,27.2854445
2662,Хотиславская амбулатория общей практики,https://healthcare.by/instinfo.php?orgnum=17441,Хотислав,Амбулатория,Outpatient Clinic,"ул. Недвигина, 18, 225920, д. Хотислав, Малоритский р-н, Брестская обл.",,51.7106672,24.0933394
2663,Хотлянская амбулатория,https://healthcare.by/instinfo.php?orgnum=6633,Хотляны,Амбулатория,Outpatient Clinic,"ул. Четвертая, 4а, 223414, аг. Хотляны, Узденский р-н, Минская обл.",,53.5431693,27.3876001
2664,Храковичская амбулатория врача общей практики,https://healthcare.by/instinfo.php?orgnum=4880,Старые Храковичи,Амбулатория,Outpatient Clinic,"ул. Чапаева В. И., 38А, 247644, д. Старые Храковичи, Брагинский р-н, Гомельская обл.",,51.6692331,30.4400061
2665,Хуторская врачебная амбулатория,https://healthcare.by/instinfo.php?orgnum=13774,Хутор,Амбулатория,Outpatient Clinic,"ул. Мира, 2, 223227, д. Хутор, Червенский р-н, Минская обл.",,53.761661,28.6806186
2666,Циринская амбулатория врача общей практики,https://healthcare.by/instinfo.php?orgnum=12546,Цирин,Амбулатория,Outpatient Clinic,"231455, д. Цирин, Кореличский р-н, Гродненская обл.",,53.4059332,26.1560804
2667,Ченковская АОП,https://healthcare.by/instinfo.php?orgnum=12221,Ченки,Амбулатория,Outpatient Clinic,"ул. Речная, 15, 247001, п. Ченки, Гомельский р-н, Гомельская обл.",,52.3504774,30.9744979
2668,Червоненская амбулатория общей практики,https://healthcare.by/instinfo.php?orgnum=5006,Червоное,Амбулатория,Outpatient Clinic,"ул. Поселковая, 33, 247988, пос. Червоное, Житковичский р-н, Гомельская обл.",,52.3637211,27.9091019
2669,Чернинская врачебная амбулатория общей практики,https://healthcare.by/instinfo.php?orgnum=9300,Черни,Амбулатория,Outpatient Clinic,"ул. Пионерская, 7, 225001, д. Черни, Брестский р-н, Брестская обл.",,52.14984949999999,23.7529906
2670,Черноборская амбулатория врача общей практики,https://healthcare.by/instinfo.php?orgnum=15946,Черный Бор,Амбулатория,Outpatient Clinic,"213145, д. Черный Бор, Быховский р-н, Могилевская обл.",,53.6307614,29.982964
2671,Черноручская амбулатория врача общей практики,https://healthcare.by/instinfo.php?orgnum=26878,Черноручье,Амбулатория,Outpatient Clinic,"ул. Речная, 80а, 213022, д. Черноручье, Шкловский р-н, Могилевская обл.",,54.1697454,30.1832524
2672,Чуриловичская амбулатория,https://healthcare.by/instinfo.php?orgnum=11068,Чуриловичи,Амбулатория,Outpatient Clinic,"ул. Парковая, 23, Михоновичский с/с, 223029, д. Чуриловичи, Минский р-н, Минская обл.",,53.7414715,27.6857725
2673,Шайтеровская врачебная амбулатория,https://healthcare.by/instinfo.php?orgnum=4001,Шайтерово,Амбулатория,Outpatient Clinic,"211603, ул. Сельская, 17, д. Шайтерово, Верхнедвинский р-н, Витебская обл.",,55.7106246,28.0859322
2674,Шапечинская врачебная амбулатория,https://healthcare.by/instinfo.php?orgnum=13691,Шапечино,Амбулатория,Outpatient Clinic,"ул. Молодежная, 2Б, 211347, д. Шапечино, Витебский р-н, Витебская обл.",,55.2019886,30.2513313
2675,Шарейковская амбулатория врача общей практики,https://healthcare.by/instinfo.php?orgnum=7273,Шарейки,Амбулатория,Outpatient Clinic,"ул. Центральная, 1б, 213649, д. Шарейки, Костюковичский р-н, Могилевская обл.",,51.99927959999999,29.4614153
2676,Шашковская амбулатория,https://healthcare.by/instinfo.php?orgnum=11461,Шашки,Амбулатория,Outpatient Clinic,"ул. Советская, 17/1, 222675, д. Шашки, Столбцовский р-н, Минская обл.",,54.0047692,27.2956698
2677,Швабский ФАП,https://healthcare.by/instinfo.php?orgnum=13812,Червонная Швабовка,ФАП,FAP,"223118, д. Швабы, Логойский р-н, Минская обл.",,54.279849,28.16169
2678,Шершунская амбулатория,https://healthcare.by/instinfo.php?orgnum=11066,Шаршуны,Амбулатория,Outpatient Clinic,"ул. Савенко, 16а, Роговский с/с, 223048, п. Шаршуны, Минский р-н, Минская обл.",,53.92328819999999,27.5612344
2679,Широковская АВОП,https://healthcare.by/instinfo.php?orgnum=12163,Широкое,Амбулатория,Outpatient Clinic,"247384, д. Широкое, Буда-Кошелевский р-н, Гомельская обл.",,52.69427,30.8893812
2680,Щедринская врачебная амбулатория общей практики,https://healthcare.by/instinfo.php?orgnum=10577,Щедрин,Амбулатория,Outpatient Clinic,"ул. Комсомольская, 12, 247235, д. Щедрин, Жлобинский р-н, Гомельская обл.",,52.8938868,30.0441843
2681,Щомыслицкая амбулатория,https://healthcare.by/instinfo.php?orgnum=11067,Щемыслица,Амбулатория,Outpatient Clinic,"ул. Корюльникова, 7, Щомыслицкий с/с, 223049, аг. Щемыслица, Минский р-н, Минская обл.",,53.8230249,27.4516214
2682,"Щорсовская амбулатория врача общей практики, амбулатория",https://healthcare.by/instinfo.php?orgnum=10933,Щорсы,Амбулатория,Outpatient Clinic,"ул. Парковая, 23а, 231428, д. Щорсы, Новогрудский р-н, Гродненская обл.",,53.6518595,26.1700205
2683,Эйгердовский ФАП,https://healthcare.by/instinfo.php?orgnum=21672,Эйгирды,ФАП,FAP,"ул. Молодежная, 6, 231363, д. Эйгирды, Ивьевский р-н, Гродненская обл.",,54.010882,25.925074
2684,Эйсмонтовская амбулатория общей практики,https://healthcare.by/instinfo.php?orgnum=14087,Большие Эйсмонты,Амбулатория,Outpatient Clinic,"231785, д. Большие Эйсмонты, Берестовицкий р-н, Гродненская обл.",,53.3683499,24.074288
2685,Эсьмонский ФАП,https://healthcare.by/instinfo.php?orgnum=9010,Эсьмоны,ФАП,FAP,"213171, д. Эсьмоны, Белыничский р-н, Могилевская обл.",,54.017046,29.549749
2686,Яечковичская амбулатория врача общей практики,https://healthcare.by/instinfo.php?orgnum=17801,Яечковичи,Амбулатория,Outpatient Clinic,"ул. Советская, 42, 225802, д. Яечковичи, Ивановский р-н, Брестская обл.",,52.14851100000001,25.539992
2687,Язвинская амбулатория врача общей практики,https://healthcare.by/instinfo.php?orgnum=3359,Язвинки,Амбулатория,Outpatient Clinic,"ул. Ленина, 131в, 225651, д. Язвинки, Лунинецкий р-н, Брестская обл.",,52.2526443,26.9055313
2688,Языльская врачебная амбулатория,https://healthcare.by/instinfo.php?orgnum=6605,Языль,Амбулатория,Outpatient Clinic,"ул. Половчени, 1Б, 222924, аг. Языль, Стародорожский р-н, Минская обл.",,52.9825169,27.9666561
2689,Ямницкая амбулатория врача общей практики,https://healthcare.by/instinfo.php?orgnum=7332,Голынец,Амбулатория,Outpatient Clinic,"д. Голынец, Могилевский р-н, Могилевская обл.",,53.8544519,30.1597023
2690,Яновичская врачебная амбулатория,https://healthcare.by/instinfo.php?orgnum=6292,Яновичи,Амбулатория,Outpatient Clinic,"ул. Парковая, 1, 222659, д. Яновичи, Клецкий р-н, Минская обл.",,53.0164876,26.6495378
2691,1-я городская клиническая больница,https://healthcare.by/instinfo.php?orgnum=1797,Минск,Больница,Hospital,"пр. Независимости, 64, 220013, г. Минск",http://1gkb.by,53.9192948,27.595938
2692,10-я городская клиническая больница,https://healthcare.by/instinfo.php?orgnum=2019,Минск,Больница,Hospital,"ул. Уборевича, 73, 220096, г. Минск",http://10gkb.by,53.83892239999999,27.6532175
2693,11-я городская клиническая больница,https://healthcare.by/instinfo.php?orgnum=446,Минск,Больница,Hospital,"ул. Корженевского, 4, 220108, г. Минск",http://11gkb.by,53.8459567,27.4980267
2694,2-я городская детская клиническая больница,https://healthcare.by/instinfo.php?orgnum=2102,Минск,Больница,Hospital,"ул. Нарочанская, 17, 220020, г. Минск",http://info2gdp.by,53.9325181,27.4818519
2695,2-я городская клиническая больница,https://healthcare.by/instinfo.php?orgnum=1810,Минск,Больница,Hospital,"ул. Энгельса, 25, 220030, г. Минск",http://2gkb.by,53.8976607,27.5667585
2696,3-я городская детская клиническая больница,https://healthcare.by/instinfo.php?orgnum=2117,Минск,Больница,Hospital,"ул. Лейтенанта Кижеватова, д. 60, кор. 1, 220024, г. Минск",http://3gdkb.by,53.8496426,27.534279
2697,3-я городская клиническая больница им. Е. В. Клумова,https://healthcare.by/instinfo.php?orgnum=1833,Минск,Больница,Hospital,"ул. Ленина, 30, 220030, г. Минск",http://3gkb.by,53.8960935,27.5634415
2698,4-я городская детская клиническая больница,https://healthcare.by/instinfo.php?orgnum=2134,Минск,Больница,Hospital,"ул. Шишкина, 24, 220118, г. Минск",http://4gdkb.by,53.8610857,27.6342834
2699,4-я городская клиническая больница им. Н. Е. Савченко,https://healthcare.by/instinfo.php?orgnum=1860,Минск,Больница,Hospital,"ул. Р. Люксембург, 110, 220036, г. Минск",http://4gkb.by,53.8917441,27.5180577
2700,5-я городская клиническая больница,https://healthcare.by/instinfo.php?orgnum=1899,Минск,Больница,Hospital,"ул. Филатова, 9, 220026, г. Минск",http://5gkb.by,53.8705297,27.6323149
2701,6-я городская клиническая больница,https://healthcare.by/instinfo.php?orgnum=1937,Минск,Больница,Hospital,"ул. Уральская, 5, 220037, г. Минск",http://6gkb.by,53.9022112,27.6074611
2702,Амбулатория врача общей практики Видзовской БСУ,https://healthcare.by/instinfo.php?orgnum=3973,Видзы,Амбулатория,Outpatient Clinic,"ул. Кирова, 8, 211970, г.п. Видзы, Браславский р-н, Витебская обл.",,55.63502099999999,27.044085
2703,Амбулатория врача общей практики Друевской БСУ,https://healthcare.by/instinfo.php?orgnum=3976,Друя,Амбулатория,Outpatient Clinic,"ул. Ленина, 72, 211960, г.п. Друя, Браславский р-н, Витебская обл.",,55.7794897,27.4780922
2704,Антопольская больница сестринского ухода,https://healthcare.by/instinfo.php?orgnum=26813,Антополь,Больница,Hospital,"ул. Советская, 1, 225850, г.п. Антополь, Дрогичинский р-н, Брестская обл.",,52.2079379,24.7681625
2705,Антопольская городская больница,https://healthcare.by/instinfo.php?orgnum=3233,Антополь,Больница,Hospital,"ул. Советская, 1, 225850, г.п. Антополь, Дрогичинский р-н, Брестская обл.",,52.2079379,24.7681625
2706,Атолинская больница,https://healthcare.by/instinfo.php?orgnum=9533,Атолино,Больница,Hospital,"ул. Западная, 22, 223011, аг. Атолино, Минский р-н, Минская обл.",,53.785838,27.4309671
2707,Бабиничская амбулатория врача общей практики,https://healthcare.by/instinfo.php?orgnum=13681,Бабиничи,Амбулатория,Outpatient Clinic,"ул. Юбилейная, 1В, 211240, д. Бабиничи, Витебский р-н, Витебская обл.",,55.2595778,30.3630691
2708,Бабичевская больница сестринского ухода с амбулаторией общей практики,https://healthcare.by/instinfo.php?orgnum=11312,Бабичи,Больница,Hospital,"211804, д. Бабичи, Глубокский р-н, Витебская обл.",,55.2646186,27.6180613
2709,Барановичская городская больница,https://healthcare.by/instinfo.php?orgnum=3104,Барановичи,Больница,Hospital,"ул. Брестская, 133, 225406, г. Барановичи, Брестская обл.",http://barcityhospital.by,53.1298107,25.9956503
2710,Барановичская городская больница № 2,https://healthcare.by/instinfo.php?orgnum=453,Барановичи,Больница,Hospital,"Слонимское шоссе, 8, 225413, г. Барановичи, Брестская обл.",http://bargbo2.by,53.1100218,25.9504426
2711,Барановичская городская поликлиника № 3,https://healthcare.by/instinfo.php?orgnum=3153,Барановичи,Поликлиника,Polyclinic,"ул. Горького, 56, 225329, г. Барановичи, Брестская обл.",,53.1309264,26.0006275
2712,Барановичская детская городская больница,https://healthcare.by/instinfo.php?orgnum=3128,Барановичи,Больница,Hospital,"ул. Куйбышева, 46, 225320, г. Барановичи, Брестская обл.",http://baranovichi-detstvo.by,53.1270589,26.0054809
2713,Бараньская амбулатория,https://healthcare.by/instinfo.php?orgnum=6173,Барань,Амбулатория,Outpatient Clinic,"ул. Больничная, 4, 222150, д. Барань, Борисовский р-н, Минская обл.",,54.49147559999999,28.6672066
2714,Бацевичская амбулатория врача общей практики,https://healthcare.by/instinfo.php?orgnum=16281,Бацевичи,Амбулатория,Outpatient Clinic,"ул. Заречная, 213901, д. Бацевичи, Кличевский р-н, Могилевская обл.",,53.3910324,29.2382723
2715,Бацевичская больница сестринского ухода,https://healthcare.by/instinfo.php?orgnum=26872,Бацевичи,Больница,Hospital,"213901, д. Бацевичи, Кличевский р-н, Могилевская обл.",,53.3977661,29.2300634
2716,Бегомльская районная больница,https://healthcare.by/instinfo.php?orgnum=4041,Бегомль,Больница,Hospital,"пер. Советский, 1а, 211730, г.п. Бегомль, Докшицкий р-н, Витебская обл.",,54.7302419,28.0607868
2717,Бездежская участковая больница,https://healthcare.by/instinfo.php?orgnum=17740,Бездеж,Больница,Hospital,"ул. Зеленая, 1, 225848, д. Бездеж, Дрогичинский р-н, Брестская обл.",,52.31377,25.3055478
2718,Белицкая амбулатория врача общей практики,https://healthcare.by/instinfo.php?orgnum=4344,Белица,Амбулатория,Outpatient Clinic,"211111, д.Пламя, Сенненский р-н, Витебская обл.",,54.6844468,29.61896369999999
2719,Белицкая АОП,https://healthcare.by/instinfo.php?orgnum=5249,Белицк,Амбулатория,Outpatient Clinic,"ул. Ленина, 1А, 247673, г.п. Белицк, Рогачевский р-н, Гомельская обл.",,52.9399282,30.4102589
2720,Белицкая участковая больница,https://healthcare.by/instinfo.php?orgnum=5779,Белица,Больница,Hospital,"231315, д. Белица, Лидский р-н, Гродненская обл.",,53.6508847,25.3177272
2721,Беличская врачебная амбулатория,https://healthcare.by/instinfo.php?orgnum=11514,Беличи,Амбулатория,Outpatient Clinic,"ул. Центральная, 73а, 223614, д. Беличи, Слуцкий р-н, Минская обл.",,52.9452994,27.4439922
2722,Белоозерская городская больница,https://healthcare.by/instinfo.php?orgnum=18355,Белоозерск,Больница,Hospital,"ул. Строителей, 17, 225215, г. Белоозерск, Березовский р-н, Брестская обл.",,52.4659929,25.1761254
2723,Белыничская ЦРБ,https://healthcare.by/instinfo.php?orgnum=6975,Белыничи,Больница,Hospital,"ул. Оборонная, 1, 213051, г. Белыничи, Могилевская обл.",http://clinic-belynichi.by,53.99961889999999,29.7120579
2724,Бережновская больница сестринского ухода с амбулаторией общей практики,https://healthcare.by/instinfo.php?orgnum=23432,Бережное,Больница,Hospital,"ул. Ленина, 34а, 225532, д. Бережное, Столинский р-н, Брестская обл.",,51.9703082,27.0593859
2725,Березинская больница сестринского ухода с врачебной амбулаторией,https://healthcare.by/instinfo.php?orgnum=4042,Березино,Больница,Hospital,"ул. Заречная, 29, 211732, д. Березино, Докшицкий р-н, Витебская обл.",,54.9059768,28.1902536
2726,Березинская участковая больница,https://healthcare.by/instinfo.php?orgnum=6430,Березинское,Больница,Hospital,"222313, ул. Октябрьская, 21, а.г. Березинское, Молодеченский р-н, Минская обл.",,53.8337495,28.9929962
2727,Березинская ЦРБ,https://healthcare.by/instinfo.php?orgnum=6107,Березино,Больница,Hospital,"ул. М. Романович, 6, 223311, г. Березино, Минская обл.",http://berezinocrb.by,53.8241289,28.98868199999999
2728,Березковская больница сестринского учета с врачебной амбулаторией,https://healthcare.by/instinfo.php?orgnum=4043,Березки,Больница,Hospital,"ул. Центральная, 1, 211738, д. Березки, Докшицкий р-н, Витебская обл.",,54.7004958,27.8136472
2729,Березовская городская больница,https://healthcare.by/instinfo.php?orgnum=5772,Березовка,Больница,Hospital,"ул. Школьная, 36, 231306, г. Березовка, Лидский р-н, Гродненская обл.",,53.725936,25.513439
2730,Березовская ЦРБ им. Э.Э.Вержбицкого,https://healthcare.by/instinfo.php?orgnum=18304,Береза,Больница,Hospital,"ул. Ленина, 1, 225209, г. Береза, Брестская обл.",http://crbbrz.by,52.5378544,24.9972318
2731,Берестовицкая ЦРБ,https://healthcare.by/instinfo.php?orgnum=5617,Большая Берестовица,Больница,Hospital,"ул. Ленина, 10, 231778, г.п. Большая Берестовица, Гродненская обл.",http://bercrb.by,53.1964406,24.017647
2732,Бешенковичская ЦРБ,https://healthcare.by/instinfo.php?orgnum=3945,Бешенковичи,Больница,Hospital,"Витебское шоссе, 36, 211361, г.п. Бешенковичи, Витебская обл.",http://beshenkovichicrb.by,55.0470251,29.47657929999999
2733,Бигосовская участковая больница,https://healthcare.by/instinfo.php?orgnum=3997,Бигосово,Больница,Hospital,"211640, ул. Молодежная, 17, д. Бигосово, Верхнедвинский р-н, Витебская обл.",,55.916407,27.7503527
2734,Бобовнянская больница сестринского ухода,https://healthcare.by/instinfo.php?orgnum=20531,Бобовня,Больница,Hospital,"д. Бобовня, Копыльский р-н, Минская обл.",,53.2607392,26.9541738
2735,Бобриковская участковая больница,https://healthcare.by/instinfo.php?orgnum=26822,Бобрик,Больница,Hospital,"ул. Чапаева, 29, д. Бобрик, Пинский р-н, Брестская обл.",,52.1201024,26.0795134
2736,Бобровичская участковая больница,https://healthcare.by/instinfo.php?orgnum=15895,Бобровичи,Больница,Hospital,"ул. Лесная, 100, 247703, н.п. Бобровичи, Калинковичский р-н, Гомельская обл.",,52.124005,29.35009609999999
2737,Бобруйская городская больница скорой медицинской помощи им. В.О. Морзона,https://healthcare.by/instinfo.php?orgnum=7006,Бобруйск,Больница,Hospital,"ул. Пролетарская, 50, 213815, г. Бобруйск, Могилевская обл.",http://bgbsmp.by,53.1445979,29.2158424
