,facility_title,link,settlement,facility_type,facility_type_eng,address,website,latitude,longitude
0,Агеевский ФАП,https://healthcare.by/instinfo.php?orgnum=16445,Агеевка,ФАП,FAP,"ул. Сиреневая, 9, 213114, д. Агеевка, Могилевский р-н, Могилевская обл.",,53.959718,30.48202
1,Адамовский ФАП,https://healthcare.by/instinfo.php?orgnum=17185,Адамово,ФАП,FAP,"д. Адамово, Воложинский р-н, Минская обл.",,54.138781,26.308645
2,Адаховщинский ФАП,https://healthcare.by/instinfo.php?orgnum=18082,Адаховщина,ФАП,FAP,"пер. Парковый, 10, 225372, д. Адаховщина, Ляховичский р-н, Брестская обл.",,53.153936,26.180716
3,Азделинский ФАП,https://healthcare.by/instinfo.php?orgnum=15701,Азделино,ФАП,FAP,"ул. Новая, 1а, 247025, д. Азделино, Гомельский р-н, Гомельская обл.",,52.540376,30.744805
4,Азинский ФАП,https://healthcare.by/instinfo.php?orgnum=15299,Азино,ФАП,FAP,"211424, д. Азино, Полоцкий р-н, Витебская обл.",,55.623392,28.643457
5,Александровский ФАП,https://healthcare.by/instinfo.php?orgnum=16081,Александровка,ФАП,FAP,"д. 9А, 247507, д. Александровка, Речицкий р-н, Гомельская обл.",,52.315905,30.582758
6,Александровский ФАП,https://healthcare.by/instinfo.php?orgnum=15850,Александровка,ФАП,FAP,"ул. Первомайская, 85, 247718, д. Александровка, Калинковичский р-н, Гомельская обл.",,52.153072,29.499695
7,Алексеевичский ФАП,https://healthcare.by/instinfo.php?orgnum=17747,Алексеевичи,ФАП,FAP,"ул. Ленина, 18, 225834, д. Алексеевичи, Дрогичинский р-н, Брестская обл.",,52.279236,24.996368
8,Алексиничский ФАП,https://healthcare.by/instinfo.php?orgnum=15416,Алексиничи,ФАП,FAP,"д. Алексиничи, Сенненский р-н, Витебская обл.",,54.770733,29.972379
9,Алешковичский ФАП,https://healthcare.by/instinfo.php?orgnum=16950,Олешковичи,ФАП,FAP,"213170, д. Олешковичи, Белыничский р-н, Могилевская обл.",,54.037942,29.635951
10,Альбянский ФАП,https://healthcare.by/instinfo.php?orgnum=14945,Биозавода,ФАП,FAP,"п. Биозавода, Несвижский р-н, Минская обл.",,53.240404,26.591309
11,Амбросовичский ФАП,https://healthcare.by/instinfo.php?orgnum=15506,Амбросовичи,ФАП,FAP,"211262, д. Амбросовичи, Шумилинский р-н, Витебская обл.",,55.319561,29.476896
12,"Амховский ФАП, ФАП",https://healthcare.by/instinfo.php?orgnum=29157,Амховая 1-я,ФАП,FAP,"ул. Молодежная, 5, 213109, д. Амховая 1-я, Могилевский р-н, Могилевская обл.",,53.794321,30.526029
13,Ананичский ФАП,https://healthcare.by/instinfo.php?orgnum=15117,Ананичи,ФАП,FAP,"д. Ананичи, Пуховичский р-н, Минская обл.",,53.631075,28.128722
14,Ананчицкий ФАП,https://healthcare.by/instinfo.php?orgnum=17327,Ананчицы,ФАП,FAP,"ул. Козлова, 1, 223741, д. Ананчицы, Солигорский р-н, Минская обл.",,52.528714,27.650881
15,Андроновский ФАП,https://healthcare.by/instinfo.php?orgnum=15338,Андроны,ФАП,FAP,"Юньковский с/с, 211875, д. Андроны, Поставский р-н, Витебская обл.",,55.058812,26.918009
16,Антоновский ФАП,https://healthcare.by/instinfo.php?orgnum=15849,Антоновка,ФАП,FAP,"ул. Советская, 44А, 247730, д. Антоновка, Калинковичский р-н, Гомельская обл.",,52.163432,29.281242
17,Антоновский ФАП,https://healthcare.by/instinfo.php?orgnum=15810,Антоновка,ФАП,FAP,"ул. Интернациональная, 12, 247248, д. Антоновка, Жлобинский р-н, Гомельская обл.",,52.983243,30.149141
18,Антоновский ФАП,https://healthcare.by/instinfo.php?orgnum=15756,Антоновка,ФАП,FAP,"ул. Комсомольская, 37, 247073, д. Антоновка, Добрушский р-н, Гомельская обл.",,52.245392,31.23683
19,Антоновский ФАП,https://healthcare.by/instinfo.php?orgnum=16661,Антоновка,ФАП,FAP,"ул. Юбилейная, 5, 213220, д. Антоновка, Чаусский р-н, Могилевская обл.",,53.813384,30.638094
20,Антопольевский ФАП,https://healthcare.by/instinfo.php?orgnum=15473,Антополье,ФАП,FAP,"ул. Гагарина, 38, 211157, д. Антополье, Чашникский р-н, Витебская обл.",,54.661953,29.389588
21,Арабовщинский ФАП,https://healthcare.by/instinfo.php?orgnum=17630,Арабовщина,ФАП,FAP,"ул. Карвата, 1, 225314, д. Арабовщина, Барановичский р-н, Брестская обл.",,53.261949,26.042106
22,Артуковский ФАП,https://healthcare.by/instinfo.php?orgnum=16080,Артуки,ФАП,FAP,"ул. Советская, 37а, 247503, д. Артуки, Речицкий р-н, Гомельская обл.",,52.149155,30.533054
23,Асаревичский ФАП,https://healthcare.by/instinfo.php?orgnum=15630,Асаревичи,ФАП,FAP,"ул. Колхозная, 6, 247662, д. Асаревичи, Брагинский р-н, Гомельская обл.",,51.60872,30.49448
24,Аталезский ФАП,https://healthcare.by/instinfo.php?orgnum=16944,Аталезь,ФАП,FAP,"ул. Мамонтова, 5, 222673, аг. Аталезь, Столбцовский р-н, Минская обл.",,53.571589,26.59899
25,Ахремовская амбулатория врача общей практики,https://healthcare.by/instinfo.php?orgnum=15097,Ахремовцы,Амбулатория,Outpatient Clinic,"ул. Школьная, 76, 211972, д. Ахремовцы, Браславский р-н, Витебская обл.",,55.575042,27.117093
26,Б. Негновичский ФАП,https://healthcare.by/instinfo.php?orgnum=16887,Большие Негновичи,ФАП,FAP,"ул. Центральная, д. Большие Негновичи, Борисовский р-н, Минская обл.",,54.228422,28.753743
27,Б. Осовский ФАП,https://healthcare.by/instinfo.php?orgnum=15324,Большое Осово,ФАП,FAP,"д. Большое Осово, Крупский р-н, Минская обл.",,54.46186,28.786298
28,Бабировский ФАП,https://healthcare.by/instinfo.php?orgnum=16060,Бабирово,ФАП,FAP,"Кирова, 52, 213879, д. Бабирово, Глусский р-н, Могилевская обл.",,53.037153,28.552664
29,Бабичский ФАП,https://healthcare.by/instinfo.php?orgnum=28087,Бабичи,ФАП,FAP,"ул. Садовая, 1, д. Бабичи, Чечерский р-н, Гомельская обл.",,52.878986,31.178484
30,Бабичский ФАП,https://healthcare.by/instinfo.php?orgnum=16089,Бабичи,ФАП,FAP,"ул. Мастрюкова, 17, 247534, д. Бабичи, Речицкий р-н, Гомельская обл.",,52.261645,30.00356
31,Бабуничский ФАП,https://healthcare.by/instinfo.php?orgnum=16035,Бабуничи,ФАП,FAP,"ул. Шурина, 3, 247932, д. Бабуничи, Петриковский р-н, Гомельская обл.",,52.277098,28.467153
32,Баевский ФАП,https://healthcare.by/instinfo.php?orgnum=15221,Баево,ФАП,FAP,"211052, д. Баево, Дубровенский р-н, Витебская обл.",,54.484749,31.107814
33,Бакуновский-1 ФАП,https://healthcare.by/instinfo.php?orgnum=17389,Бакуны-1,ФАП,FAP,"ул. Центральная, 71, 225142, д. Бакуны-1, Пружанский р-н, Брестская обл.",,52.544062,24.43458
34,Балашевичский ФАП,https://healthcare.by/instinfo.php?orgnum=16032,Балашевичи,ФАП,FAP,"Ленина, 1, 213865, д. Балашевичи, Глусский р-н, Могилевская обл.",,52.900779,28.792227
35,Балашовский ФАП,https://healthcare.by/instinfo.php?orgnum=17227,Балаши,ФАП,FAP,"ул. Малькевича, 16, д. Балаши, Вилейский р-н, Минская обл.",,54.622502,27.085122
36,Барановичский ФАП,https://healthcare.by/instinfo.php?orgnum=16720,Барановичи,ФАП,FAP,"231435, д. Барановичи, Кореличский р-н, Гродненская обл.",,53.511237,25.986186
37,Барановский ФАП,https://healthcare.by/instinfo.php?orgnum=23533,Бараново,ФАП,FAP,"д. Бараново, Гродненский р-н, Гродненская обл.",,53.518245,23.91689
38,Барбаровский ФАП,https://healthcare.by/instinfo.php?orgnum=16320,Барбаров,ФАП,FAP,"ул. Молодежная, 10-1, 247753, д. Барбаров, Мозырский р-н, Гомельская обл.",,51.904643,29.477066
39,Барсеевский ФАП,https://healthcare.by/instinfo.php?orgnum=15238,Барсеево,ФАП,FAP,"Горбовский с/с, 211204, д. Барсеево, Лиозненский р-н, Витебская обл.",,54.86256,30.706321
40,Барсуковский ФАП,https://healthcare.by/instinfo.php?orgnum=15204,Барсуки,ФАП,FAP,"ул. Молодежная, 8, 211729, д. Барсуки, Докшицкий р-н, Витебская обл.",,54.876004,27.617706
41,Барсуковский ФАП,https://healthcare.by/instinfo.php?orgnum=7244,Барсуки,ФАП,FAP,"2136506, д. Барсуки, Климовичский р-н, Могилевская обл.",,53.706929,31.906865
42,Барсуковский ФАП,https://healthcare.by/instinfo.php?orgnum=16370,Барсуки,ФАП,FAP,"ул. Центральная, 27а, д. Барсуки, Кировский р-н, Могилевская обл.",,53.240986,29.725235
43,Барсуковский ФАП,https://healthcare.by/instinfo.php?orgnum=14874,Барсуки,ФАП,FAP,"д. Барсуки, Смолевичский р-н, Минская обл.",,53.995927,28.186924
44,Барчицкий ФАП,https://healthcare.by/instinfo.php?orgnum=18476,Барчицы,ФАП,FAP,"ул. Садовая, 2а, д. Барчицы, Кировский р-н, Могилевская обл.",,53.254257,29.670159
45,Барышевский ФАП,https://healthcare.by/instinfo.php?orgnum=16666,Барышевка,ФАП,FAP,"ул. Школьная, 57, кв. 4, 213202, д. Барышевка, Чаусский р-н, Могилевская обл.",,53.873319,31.087925
46,Бастеновичский ФАП,https://healthcare.by/instinfo.php?orgnum=16555,Бастеновичи,ФАП,FAP,"213484, д. Бастеновичи, Мстиславский р-н, Могилевская обл.",,54.032877,31.385824
47,Бастунский ФАП,https://healthcare.by/instinfo.php?orgnum=16534,Бастуны,ФАП,FAP,"231371, д. Бастуны, Вороновский р-н, Гродненская обл.",,54.077058,25.288285
48,Батченский ФАП,https://healthcare.by/instinfo.php?orgnum=17965,Батчи,ФАП,FAP,"ул. Садовая, 14, 225874, д. Батчи, Кобринский р-н, Брестская обл.",,52.240104,24.22671
49,Бацуньский ФАП,https://healthcare.by/instinfo.php?orgnum=15671,Бацунь,ФАП,FAP,"247356, д. Бацунь, Буда-Кошелевский р-н, Гомельская обл.",,52.58235,30.570505
50,Башневский ФАП,https://healthcare.by/instinfo.php?orgnum=17711,Башни,ФАП,FAP,"ул. Луговая, 20, 211279, д. Башни, Шумилинский р-н, Витебская обл.",,55.223725,29.672414
51,Безверховичский ФАП,https://healthcare.by/instinfo.php?orgnum=17138,Безверховичи,ФАП,FAP,"р. Мурашки, 19, д. Безверховичи, Слуцкий р-н, Минская обл.",,53.019975,27.444826
52,Безуевский ФАП,https://healthcare.by/instinfo.php?orgnum=16088,Безуев,ФАП,FAP,"247560, д. Безуев, 98 Речицкий р-н, Гомельская обл.",,52.26978,30.347983
53,Белановичский ФАП,https://healthcare.by/instinfo.php?orgnum=16043,Белановичи,ФАП,FAP,"ул. Первомайская, 19А, 247903, д. Белановичи, Петриковский р-н, Гомельская обл.",,52.141008,28.575077
54,Беларучский ФАП,https://healthcare.by/instinfo.php?orgnum=16918,Алекшицы,ФАП,FAP,"223114, д. Алекшицы, Логойский р-н, Минская обл.",,54.10919,27.595024
55,Белевичский ФАП,https://healthcare.by/instinfo.php?orgnum=17925,Белевичи,ФАП,FAP,"213154, д. Белевичи, Могилевский р-н, Могилевская обл.",,53.797773,29.833185
56,Белевский ФАП,https://healthcare.by/instinfo.php?orgnum=15784,Белев,ФАП,FAP,"ул. Советская, 247962, д. Белев, Житковичский р-н, Гомельская обл.",,52.449651,28.02511
57,Белицкий ФАП,https://healthcare.by/instinfo.php?orgnum=15811,Белица,ФАП,FAP,"ул. Комсомольская, 18а, 247202, д. Белица, Жлобинский р-н, Гомельская обл.",,52.93547,29.957018
58,Белоболотский ФАП,https://healthcare.by/instinfo.php?orgnum=16090,Белое Болото,ФАП,FAP,"ул. Молодежная, 23, 247514, д. Белое Болото, Речицкий р-н, Гомельская обл.",,52.259054,30.498011
59,Белодубровский ФАП,https://healthcare.by/instinfo.php?orgnum=16348,Белая Дуброва,ФАП,FAP,"ул. Школьная. 1, 213651, д. Белая Дуброва, Костюковичский р-н, Могилевская обл.",,53.249952,31.972712
60,Белолипский ФАП,https://healthcare.by/instinfo.php?orgnum=15417,Белая Липа,ФАП,FAP,"д. Белая Липа, Сенненский р-н, Витебская обл.",,54.913836,29.740039
61,"Белоусовщинский ФАП, ФАП",https://healthcare.by/instinfo.php?orgnum=28879,Белоусовщина,ФАП,FAP,"ул. Комсомольская, 14, 225178, свх. Белоусовщина, Пружанский р-н, Брестская обл.",,52.593199,24.48131
62,Бельковский ФАП,https://healthcare.by/instinfo.php?orgnum=15340,Бельки,ФАП,FAP,"211875, д. Бельки, Поставский р-н, Витебская обл.",,55.282579,27.20131
63,Бельковщинский ФАП,https://healthcare.by/instinfo.php?orgnum=15171,Бельковщина,ФАП,FAP,"211621, д. Бельковщина, Верхнедвинский р-н, Витебская обл.",,55.854921,28.130402
64,Бельский ФАП,https://healthcare.by/instinfo.php?orgnum=16274,Белая,ФАП,FAP,"ул. Советская, 21, 247763, д. Белая, Мозырский р-н, Гомельская обл.",,52.058815,29.241321
65,Бельский ФАП,https://healthcare.by/instinfo.php?orgnum=17981,Бельск,ФАП,FAP,"ул. Советская, 3, 225865, д. Бельск, Кобринский р-н, Брестская обл.",,52.016839,24.402555
66,Беляевский ФАП,https://healthcare.by/instinfo.php?orgnum=28133,Беляевка,ФАП,FAP,"ул. Новая,4, 247169, д. Беляевка, Чечерский р-н, Гомельская обл.",,52.96082,31.024639
67,Белянский ФАП,https://healthcare.by/instinfo.php?orgnum=16937,Белое,ФАП,FAP,"223137, д. Белое, Логойский р-н, Минская обл.",,54.462268,27.585008
68,Бенинский ФАП,https://healthcare.by/instinfo.php?orgnum=16791,Бенин,ФАП,FAP,"ул. Приозерная, 7а, 231415, д. Бенин, Новогрудский р-н, Гродненская обл.",,53.754194,25.835808
69,Бервеновский ФАП,https://healthcare.by/instinfo.php?orgnum=15673,Ховхло,ФАП,FAP,"247395, д. Ховхло, Буда-Кошелевский р-н, Гомельская обл.",,52.521821,30.421995
70,Бережецкий ФАП,https://healthcare.by/instinfo.php?orgnum=15786,Бережцы,ФАП,FAP,"пер. Советский, 7, 247964, д. Бережцы, Житковичский р-н, Гомельская обл.",,51.994413,27.639742
71,Березняковский ФАП,https://healthcare.by/instinfo.php?orgnum=15790,Березняки,ФАП,FAP,"ул. Ленинская, 247968, д. Березняки, Житковичский р-н, Гомельская обл.",,52.491898,27.497898
72,Березняковский ФАП,https://healthcare.by/instinfo.php?orgnum=15878,Березняки,ФАП,FAP,"ул. Мира, 8, 247733, д. Березняки, Калинковичский р-н, Гомельская обл.",,52.389736,29.133029
73,Березовичский ФАП,https://healthcare.by/instinfo.php?orgnum=15873,Березовичи,ФАП,FAP,"ул. Клубная, 7, 213860, д. Березовичи, Бобруйский р-н, Могилевская обл.",,53.12321,29.140432
74,Березовский ФАП,https://healthcare.by/instinfo.php?orgnum=18066,Береза,ФАП,FAP,"ул. Центральная, 10, 225890, д. Береза, Кобринский р-н, Брестская обл.",,52.333574,24.337876
75,Березовский ФАП,https://healthcare.by/instinfo.php?orgnum=16622,Березовка,ФАП,FAP,"213244, д. Березовка, Славгородский р-н, Могилевская обл.",,53.63871,30.982786
76,Березовский ФАП,https://healthcare.by/instinfo.php?orgnum=17613,Березовка,ФАП,FAP,"ул. Садовая, 24Б, 211719, д. Березовка, Докшицкий р-н, Витебская обл.",,54.784047,27.660691
77,Березовский ФАП,https://healthcare.by/instinfo.php?orgnum=15899,Березовка,ФАП,FAP,"ул. Молодежная, 35, 247723, д. Березовка, Калинковичский р-н, Гомельская обл.",,51.926436,29.586589
78,Березовский ФАП,https://healthcare.by/instinfo.php?orgnum=16056,Березовка,ФАП,FAP,"ул. Молодежная, 1, 213884, д. Березовка, Глусский р-н, Могилевская обл.",,52.891131,28.851614
79,Березцовский ФАП,https://healthcare.by/instinfo.php?orgnum=17483,Березцы,ФАП,FAP,"ул. Центральная, 2, 225763, д. Березцы, Пинский р-н, Брестская обл.",,52.12647,26.613893
80,Беседовичский ФАП,https://healthcare.by/instinfo.php?orgnum=17947,Беседы,ФАП,FAP,"213663, д. Беседы, Хотимский р-н, Могилевская обл.",,53.40529,32.514791
81,Беседский ФАП,https://healthcare.by/instinfo.php?orgnum=16070,Беседки,ФАП,FAP,"ул. Школьная, 1А, 247900, д. Беседки, Петриковский р-н, Гомельская обл.",,52.275307,28.797859
82,Бильдюжский ФАП,https://healthcare.by/instinfo.php?orgnum=15492,Бильдюги,ФАП,FAP,"211915, д. Бильдюги, Шарковщинский р-н, Витебская обл.",,55.398804,27.587235
83,Биордовский ФАП,https://healthcare.by/instinfo.php?orgnum=17889,Биорда,ФАП,FAP,"213904, д. Биорда, Кличевский р-н, Могилевская обл.",,53.55226,29.380893
84,Бискупский ФАП,https://healthcare.by/instinfo.php?orgnum=16802,Бискупцы,ФАП,FAP,"231303, д. Бискупцы, Лидский р-н, Гродненская обл.",,53.845955,25.559136
85,Благовичский ФАП,https://healthcare.by/instinfo.php?orgnum=16662,Благовичи,ФАП,FAP,"ул. Молодежная, 4, 213212, д. Благовичи, Чаусский р-н, Могилевская обл.",,53.836084,30.839191
86,Блужский ФАП,https://healthcare.by/instinfo.php?orgnum=15118,Блужа,ФАП,FAP,"д. Блужа, Пуховичский р-н, Минская обл.",,53.437009,28.229845
87,Бобовский ФАП,https://healthcare.by/instinfo.php?orgnum=15812,Бобовка,ФАП,FAP,"ул. Интернациональная, 27а, 247246, д. Бобовка, Жлобинский р-н, Гомельская обл.",,52.894054,30.04314
88,Бобренятский ФАП,https://healthcare.by/instinfo.php?orgnum=16325,Бобренята,ФАП,FAP,"ул. Садовая, 6-2, 247750, д. Бобренята, Мозырский р-н, Гомельская обл.",,52.012277,29.284162
89,Бобровичский ФАП,https://healthcare.by/instinfo.php?orgnum=17188,Бобровичи,ФАП,FAP,"д. Бобровичи, Воложинский р-н, Минская обл.",,54.014162,26.643205
90,Бобровичский ФАП,https://healthcare.by/instinfo.php?orgnum=19341,Бобровичи,ФАП,FAP,"247704, н.п. Бобровичи, Калинковичский р-н, Гомельская обл.",,52.29319,29.369125
91,Бобровский ФАП,https://healthcare.by/instinfo.php?orgnum=15222,Боброво,ФАП,FAP,"ул. Садовая, 2, 211057, д. Боброво, Дубровенский р-н, Витебская обл.",,54.561563,30.767065
92,Бобровский ФАП,https://healthcare.by/instinfo.php?orgnum=15614,Боброво,ФАП,FAP,"211197, д. Боброво, Лепельский р-н, Витебская обл.",,54.851521,28.706527
93,Бобыничский ФАП,https://healthcare.by/instinfo.php?orgnum=15300,Бобыничи,ФАП,FAP,"Бобыничский с/с, ул. Школьная, 10, 211431, д. Бобыничи, Полоцкий р-н, Витебская обл.",,55.454841,28.768206
94,Богдановский ФАП,https://healthcare.by/instinfo.php?orgnum=15435,Богданово,ФАП,FAP,"д. Богданово, Сенненский р-н, Витебская обл.",,54.701121,29.796471
95,Богдянский ФАП,https://healthcare.by/instinfo.php?orgnum=16497,Богди,ФАП,FAP,"231924, д. Богди, Волковысский р-н, Гродненская обл.",,53.070003,24.637644
96,Богинский ФАП,https://healthcare.by/instinfo.php?orgnum=15098,Богино,ФАП,FAP,"211995, д. Богино, Браславский р-н, Витебская обл.",,55.419468,26.80085
97,Богушовский ФАП,https://healthcare.by/instinfo.php?orgnum=15874,Богушовка,ФАП,FAP,"ул. Советская, 6, 213843, д. Богушовка, Бобруйский р-н, Могилевская обл.",,53.093397,28.941518
98,Бокиничский ФАП,https://healthcare.by/instinfo.php?orgnum=17481,Бокиничи,ФАП,FAP,"225732, д. Бокиничи, Пинский р-н, Брестская обл.",,52.285109,26.395036
99,Бокшицкий ФАП,https://healthcare.by/instinfo.php?orgnum=17140,Бокщицы,ФАП,FAP,"223640, д. Бокщицы, Слуцкий р-н, Минская обл.",,53.078004,27.606414
100,Болецкий ФАП,https://healthcare.by/instinfo.php?orgnum=15588,Новый Болецк,ФАП,FAP,"д. Новый Болецк, Городокский р-н, Витебская обл.",,55.518698,30.037453
101,Болколовский ФАП,https://healthcare.by/instinfo.php?orgnum=15491,Болколы,ФАП,FAP,"211919, д. Болколы, Шарковщинский р-н, Витебская обл.",,55.398804,27.587235
102,Болоновоселецкий ФАП,https://healthcare.by/instinfo.php?orgnum=16011,Болонов-Селец,ФАП,FAP,"213142, д. Болонов-Селец, Быховский р-н, Могилевская обл.",,53.621469,29.921499
103,Болотнянский ФАП,https://healthcare.by/instinfo.php?orgnum=16127,Болотня,ФАП,FAP,"247290, д. Болотня, Рогачевский р-н, Гомельская обл.",,53.116633,30.223926
104,Болотский ФАП,https://healthcare.by/instinfo.php?orgnum=18064,Болота,ФАП,FAP,"ул. Комсомольская, 13, 225890, д. Болота, Кобринский р-н, Брестская обл.",,52.136233,24.522804
105,Болотчицкий ФАП,https://healthcare.by/instinfo.php?orgnum=17141,Болотчицы,ФАП,FAP,"ул. Н. Село, 50, д. Болотчицы, Слуцкий р-н, Минская обл.",,52.918592,27.412253
106,Больтеникский ФАП,https://healthcare.by/instinfo.php?orgnum=16539,Больтеники,ФАП,FAP,"д. Больтеники, Вороновский р-н, Гродненская обл.",,54.08207,25.146342
107,Больтишский ФАП,https://healthcare.by/instinfo.php?orgnum=16537,Больтишки,ФАП,FAP,"231399, д. Больтишки, Вороновский р-н, Гродненская обл.",,53.939646,25.041437
108,Больше-Автюковский ФАП,https://healthcare.by/instinfo.php?orgnum=15851,Великие Автюки,ФАП,FAP,"пер. Школьный, 3, 247726, д. Великие Автюки, Калинковичский р-н, Гомельская обл.",,52.073454,29.525485
