,facility_title,link,settlement,facility_type,facility_type_eng,address,website,latitude,longitude
1949,Хворосновский ФАП,https://healthcare.by/instinfo.php?orgnum=17493,Хворосново,ФАП,FAP,"ул. Хоровца, 37а, 225756, д. Хворосно, Пинский р-н, Брестская обл.",,52.417064,25.974535
1950,"Хворостянский ФАП, ФАП",https://healthcare.by/instinfo.php?orgnum=17943,Хворостяны,ФАП,FAP,"213252, д. Хворостяны, Славгородский р-н, Могилевская обл.",,53.621495,30.865493
1951,Хизовский ФАП,https://healthcare.by/instinfo.php?orgnum=15920,Хизов,ФАП,FAP,"ул. Пионерская, 2, 247182, д. Хизов, Кормянский р-н, Гомельская обл.",,53.096376,30.613947
1952,Хильчицкий ФАП,https://healthcare.by/instinfo.php?orgnum=15789,Хильчицы,ФАП,FAP,"ул. Стадионная, 8, 247985, д. Хильчицы, Житковичский р-н, Гомельская обл.",,52.031031,27.637325
1953,Химовский ФАП,https://healthcare.by/instinfo.php?orgnum=15914,Химы,ФАП,FAP,"213855, д. Химы, Бобруйский р-н, Могилевская обл.",,53.036065,29.239579
1954,Хлупинский ФАП,https://healthcare.by/instinfo.php?orgnum=15808,Хлупин,ФАП,FAP,"пер. Луговой, 27-а, 247995, д. Хлупин, Житковичский р-н, Гомельская обл.",,52.048997,28.13112
1955,Хмельникский ФАП,https://healthcare.by/instinfo.php?orgnum=15606,Хмельник,ФАП,FAP,"211574, д. Хмельник, Городокский р-н, Витебская обл.",,55.628769,30.555179
1956,Хобненский ФАП,https://healthcare.by/instinfo.php?orgnum=15867,Хобное,ФАП,FAP,"ул. Советская, 29, 247725, д. Хобное, Калинковичский р-н, Гомельская обл.",,52.082797,29.744872
1957,Ходаковский ФАП,https://healthcare.by/instinfo.php?orgnum=16926,Ходаки,ФАП,FAP,"223138, д. Ходаки, Логойский р-н, Минская обл.",,54.53064,27.579663
1958,Ходаковский ФАП,https://healthcare.by/instinfo.php?orgnum=17849,Ходаки,ФАП,FAP,"д. Ходаки, Ивацевичский р-н, Брестская обл.",,52.67387,25.549614
1959,Ходоровский ФАП,https://healthcare.by/instinfo.php?orgnum=16986,Ходоровка,ФАП,FAP,"ул. Молодежная, 12, 213428, д. Ходоровка, Горецкий р-н, Могилевская обл.",,54.363192,31.237558
1960,"Ходоровский ФАП, ФАП",https://healthcare.by/instinfo.php?orgnum=16644,Ходорово,ФАП,FAP,"213241, д. Ходорово, Славгородский р-н, Могилевская обл.",,53.510407,31.105002
1961,Ходоровский ФАП,https://healthcare.by/instinfo.php?orgnum=16780,Ходоровцы,ФАП,FAP,"231316, д. Ходоровцы, Лидский р-н, Гродненская обл.",,53.805914,25.279113
1962,Хожовский ФАП,https://healthcare.by/instinfo.php?orgnum=15181,Хожово,ФАП,FAP,"ул. Советская, 32, 222334, аг. Хожово, Молодеченский р-н, Минская обл.",,54.245129,26.836064
1963,Хойновский ФАП,https://healthcare.by/instinfo.php?orgnum=17490,Хойно,ФАП,FAP,"ул. Центральная, 27, 225746, д. Хойно, Пинский р-н, Брестская обл.",,51.963814,26.044756
1964,Холодникский ФАП,https://healthcare.by/instinfo.php?orgnum=15905,Холодники,ФАП,FAP,"ул. Молодежная, 22, 247748, д. Холодники, Калинковичский р-н, Гомельская обл.",,52.367245,29.457905
1965,Холстовский ФАП,https://healthcare.by/instinfo.php?orgnum=15949,Холстово,ФАП,FAP,"213322, д. Холстово, Быховский р-н, Могилевская обл.",,53.559064,30.170664
1966,Холхловский ФАП,https://healthcare.by/instinfo.php?orgnum=15182,Холхлово,ФАП,FAP,"ул. Центральная, 36-1, 222335, д. Холхлово, Молодеченский р-н, Минская обл.",,54.226001,26.538255
1967,Хомичевский ФАП,https://healthcare.by/instinfo.php?orgnum=17811,Хомичево,ФАП,FAP,"ул. Комсомольская, 28, 225812, д. Хомичево, Ивановский р-н, Брестская обл.",,52.016484,25.595203
1968,Хомичевский ФАП,https://healthcare.by/instinfo.php?orgnum=17212,Хомичи,ФАП,FAP,"КСИ, 225240, д. Хомичи, Березовский р-н, Брестская обл.",,52.560955,24.940861
1969,Хомичский ФАП,https://healthcare.by/instinfo.php?orgnum=28390,Хомичи,ФАП,FAP,"213329, д. Хомичи, Быховский р-н, Могилевская обл.",,53.342473,29.96168
1970,Хомичский ФАП,https://healthcare.by/instinfo.php?orgnum=15891,Хомичи,ФАП,FAP,"ул. Молодежная, 7, 247744, д. Хомичи, Калинковичский р-н, Гомельская обл.",,52.370792,29.637155
1971,Хомичской ФАП,https://healthcare.by/instinfo.php?orgnum=16390,Хомичи,ФАП,FAP,"247744, д. Хомичи, Калинковичский р-н, Гомельская обл.",,52.369368,29.638287
1972,Хоновский ФАП,https://healthcare.by/instinfo.php?orgnum=17922,Борок,ФАП,FAP,"213151, д. Борок, Могилевский р-н, Могилевская обл.",,53.813358,30.293132
1973,Хоромский ФАП,https://healthcare.by/instinfo.php?orgnum=11964,Хоромск,ФАП,FAP,"ул. Советская, 97, д. Хоромск, Столинский р-н, Брестская обл.",,52.022819,27.10846
1974,Хорошевский ФАП,https://healthcare.by/instinfo.php?orgnum=15742,Хорошевка,ФАП,FAP,"ул. Комсомольская, 26, 247066, д. Хорошевка, Добрушский р-н, Гомельская обл.",,52.350856,31.601016
1975,Хотовижский ФАП,https://healthcare.by/instinfo.php?orgnum=17076,Хотовиж,ФАП,FAP,"213611, д. Хотовиж, Климовичский р-н, Могилевская обл.",,53.735242,32.000497
1976,Хотовской ФАП,https://healthcare.by/instinfo.php?orgnum=16978,Хотово,ФАП,FAP,"ул. Южная, 1а, 222681, д. Хотово, Столбцовский р-н, Минская обл.",,53.756919,26.631832
1977,Хотомельский ФАП,https://healthcare.by/instinfo.php?orgnum=17315,Хотомель,ФАП,FAP,"ул. Советская, 43, 225534, д. Хотомель, Столинский р-н, Брестская обл.",,51.951549,27.047995
1978,Хотюховский ФАП,https://healthcare.by/instinfo.php?orgnum=15355,Хотюхово,ФАП,FAP,"д. Хотюхово, Крупский р-н, Минская обл.",,54.436413,28.834843
1979,Храпковский ФАП,https://healthcare.by/instinfo.php?orgnum=16246,Храпков,ФАП,FAP,"ул. Строительная, 11 «А», 247609, д. Храпков, Хойникский р-н, Гомельская обл.",,51.871786,29.847666
1980,Хрисовский ФАП,https://healthcare.by/instinfo.php?orgnum=17216,Хриссы,ФАП,FAP,"п/о Белоозерское, ул. Красногвардейская, 5а, 225215, д. Хриссы, Березовский р-н, Брестская обл.",,52.506257,24.99256
1981,Худовецкий ФАП,https://healthcare.by/instinfo.php?orgnum=15357,Худовцы,ФАП,FAP,"д. Худовцы, Крупский р-н, Минская обл.",,54.380967,29.175089
1982,Цветинский ФАП,https://healthcare.by/instinfo.php?orgnum=15274,Цветино,ФАП,FAP,"211958, д. Цветино, Миорский р-н, Витебская обл.",,55.484648,28.197129
1983,Цегельнянский ФАП,https://healthcare.by/instinfo.php?orgnum=15730,Цегельня,ФАП,FAP,"ул. Молодежная, 32, 247049, д. Цегельня, Гомельский р-н, Гомельская обл.",,52.313197,31.048292
1984,Цельский ФАП,https://healthcare.by/instinfo.php?orgnum=17941,Цель,ФАП,FAP,"ул. Восточная, 7/1, 213727, в/ч Цель, Осиповичский р-н, Могилевская обл.",,53.397612,28.475175
1985,Цеперский ФАП,https://healthcare.by/instinfo.php?orgnum=14952,Цепра,ФАП,FAP,"ул. Луговая, 20, 222642, д. Цепра, Клецкий р-н, Минская обл.",,53.024449,26.711728
1986,Цитвянский ФАП,https://healthcare.by/instinfo.php?orgnum=15154,Цитва,ФАП,FAP,"д. Цитва, Пуховичский р-н, Минская обл.",,53.547959,27.859694
1987,Цнянский ФАП,https://healthcare.by/instinfo.php?orgnum=18121,Цна,ФАП,FAP,"ул. Мира, 8а, 225677, д. Цна, Лунинецкий р-н, Брестская обл.",,52.247179,26.987862
1988,Цыпковский ФАП,https://healthcare.by/instinfo.php?orgnum=15433,Цыпки,ФАП,FAP,"д. Цыпки, Сенненский р-н, Витебская обл.",,54.825244,30.173979
1989,Чахецкий ФАП,https://healthcare.by/instinfo.php?orgnum=17371,Чахец,ФАП,FAP,"д. 26""Б"", 225132, д. Чахец, Пружанский р-н, Брестская обл.",,52.490944,24.41143
1990,Чеботовичский ФАП,https://healthcare.by/instinfo.php?orgnum=12162,Чеботовичи,ФАП,FAP,"247394, д. Чеботовичи, Буда-Кошелевский р-н, Гомельская обл.",,52.564436,30.434149
1991,Челющевичский ФАП,https://healthcare.by/instinfo.php?orgnum=16061,Челющевичи,ФАП,FAP,"ул. Школьная, 15А, 247922, аг. Челющевичи, Петриковский р-н, Гомельская обл.",,52.356505,28.753698
1992,Чемерисский ФАП,https://healthcare.by/instinfo.php?orgnum=15638,Чемерисы,ФАП,FAP,"ул. Победы, 57, 247643, д. Чемерисы, Брагинский р-н, Гомельская обл.",,51.701697,30.450184
1993,Чемеровский ФАП,https://healthcare.by/instinfo.php?orgnum=17069,Чемеры,ФАП,FAP,"д. Чемеры, Слонимский р-н, Гродненская обл.",,53.096274,25.258614
1994,Чепелевский ФАП,https://healthcare.by/instinfo.php?orgnum=17353,Чепели,ФАП,FAP,"пер. Гагарина, 2а, 223720, д. Чепели, Солигорский р-н, Минская обл.",,52.872676,27.479959
1995,Чепуковский ФАП,https://healthcare.by/instinfo.php?orgnum=17642,Чепуки,ФАП,FAP,"211936, д. Чепуки, Миорский р-н, Витебская обл.",,55.568023,27.545841
1996,Червоносельский ФАП,https://healthcare.by/instinfo.php?orgnum=16610,Червоное Село,ФАП,FAP,"231946, д. Червоное Село, Зельвенский р-н, Гродненская обл.",,53.142956,24.981897
1997,Черебасовский ФАП,https://healthcare.by/instinfo.php?orgnum=18122,Черебасово,ФАП,FAP,"ул. 17 Сентября 14/1, 225664, д. Черебасово, Лунинецкий р-н, Брестская обл.",,52.246423,27.183757
1998,Черевковский ФАП,https://healthcare.by/instinfo.php?orgnum=14894,Черевки,ФАП,FAP,"д. Черевки, Мядельский р-н, Минская обл.",,54.890505,26.772904
1999,Черейщанский ФАП,https://healthcare.by/instinfo.php?orgnum=15624,Черейщина,ФАП,FAP,"211198, д. Черейщина, Лепельский р-н, Витебская обл.",,54.999914,28.801821
2000,Черемушский ФАП,https://healthcare.by/instinfo.php?orgnum=16466,Черемушки,ФАП,FAP,"213118, д. Черемушки, Кадинский с/с, Могилевский р-н, Могилевская обл.",,53.885342,30.460497
2001,Черенковский ФАП,https://healthcare.by/instinfo.php?orgnum=16708,Черенки,ФАП,FAP,"213223, д. Черенки, Чаусский р-н, Могилевская обл.",,53.620812,30.756788
2002,Чересский ФАП,https://healthcare.by/instinfo.php?orgnum=15273,Черессы,ФАП,FAP,"211945, д. Черессы, Миорский р-н, Витебская обл.",,55.623468,27.708409
2003,Черетянский ФАП,https://healthcare.by/instinfo.php?orgnum=15733,Черетянка,ФАП,FAP,"ул. Интернациональная, 56, 247017, д. Черетянка, Гомельский р-н, Гомельская обл.",,52.125292,31.276194
2004,"Черневичский ФАП, УЗ",https://healthcare.by/instinfo.php?orgnum=16892,Черневичи,ФАП,FAP,"ул. Советская, 19а, 222118, д. Черневичи, Борисовский р-н, Минская обл.",,54.03809,28.757525
2005,Черневичский ФАП,https://healthcare.by/instinfo.php?orgnum=15189,Черневичи,ФАП,FAP,"211813, д. Черневичи, Глубокский р-н, Витебская обл.",,55.18174,27.890614
2006,Черневский ФАП,https://healthcare.by/instinfo.php?orgnum=16360,Черневка,ФАП,FAP,"ул. Школьная, 10, д. Черневка, Дрибинский р-н, Могилевская обл.",,54.099856,30.812286
2007,Черниковщинский ФАП,https://healthcare.by/instinfo.php?orgnum=17298,Черниковщина,ФАП,FAP,"ул. Садовая, 22, д. Черниковщина, Дзержинский р-н, Минская обл.",,53.62659,27.276589
2008,Черниховский ФАП,https://healthcare.by/instinfo.php?orgnum=17719,Чернихово,ФАП,FAP,"ул. Торговая, 1а, 225363, д. Чернихово, Барановичский р-н, Брестская обл.",,53.244144,26.243248
2009,Черновский ФАП,https://healthcare.by/instinfo.php?orgnum=15901,Черновщина,ФАП,FAP,"247723, д. Черновщина, Калинковичский р-н, Гомельская обл.",,51.899981,29.572359
2010,Черноградский ФАП,https://healthcare.by/instinfo.php?orgnum=14854,Черноградь,ФАП,FAP,"ул. Молодежная, 122а, 223237, аг. Черноградь, Червенский р-н, Минская обл.",,53.789039,28.230977
2011,Черноручский ФАП,https://healthcare.by/instinfo.php?orgnum=15304,Черноручье 1-е,ФАП,FAP,"211421, д. Черноручье 1-е, Полоцкий р-н, Витебская обл.",,55.454376,28.756258
2012,Черняковский ФАП,https://healthcare.by/instinfo.php?orgnum=17946,Черняковка,ФАП,FAP,"213261, д. Черняковка, Славгородский р-н, Могилевская обл.",,53.320022,30.838185
2013,Чернянский ФАП,https://healthcare.by/instinfo.php?orgnum=17878,Черное,ФАП,FAP,"ул. Дорожная, 5, 213023, д. Малое Черное, Шкловский р-н, Могилевская обл.",,54.173326,30.130429
2014,Чернянский ФАП,https://healthcare.by/instinfo.php?orgnum=16123,Черное,ФАП,FAP,"ул. Восточная, 2, 247521, д. Черное, Речицкий р-н, Гомельская обл.",,52.469131,30.363362
2015,Чернянский ФАП,https://healthcare.by/instinfo.php?orgnum=17453,Черняны,ФАП,FAP,"225914, д. Черняны, Малоритский р-н, Брестская обл.",,51.820805,24.107755
2016,Черский ФАП,https://healthcare.by/instinfo.php?orgnum=17586,Черск,ФАП,FAP,"ул. Новая, 11, 225022, д. Черск, Брестский р-н, Брестская обл.",,51.713411,23.690667
2017,Четвернянский ФАП,https://healthcare.by/instinfo.php?orgnum=15822,Четверня,ФАП,FAP,"ул. Центральная, 57, 247249, д. Четверня, Жлобинский р-н, Гомельская обл.",,52.821585,30.167179
2018,Чехский ФАП,https://healthcare.by/instinfo.php?orgnum=16834,Чехи,ФАП,FAP,"ул. Зеленая, 1А, 231213, д. Чехи, Островецкий р-н, Гродненская обл.",,54.744794,26.156426
2019,Чечевичский ФАП,https://healthcare.by/instinfo.php?orgnum=16014,Чечевичи,ФАП,FAP,"213143, д. Чечевичи, Быховский р-н, Могилевская обл.",,53.521672,29.829763
2020,Чигиринский ФАП,https://healthcare.by/instinfo.php?orgnum=16205,Чигиринка,ФАП,FAP,"ул. Друтская, 34, д. Чигиринка, Кировский р-н, Могилевская обл.",,53.4216,29.846283
2021,Чкаловский ФАП,https://healthcare.by/instinfo.php?orgnum=15732,Чкалово,ФАП,FAP,"ул. Калинина, 57, 247038, д. Чкалово, Гомельский р-н, Гомельская обл.",,52.283489,30.882606
2022,Чуденичский ФАП,https://healthcare.by/instinfo.php?orgnum=16922,Чуденичи,ФАП,FAP,"223115, д. Чуденичи, Логойский р-н, Минская обл.",,54.143771,27.790093
2023,Чуриловский ФАП,https://healthcare.by/instinfo.php?orgnum=16868,Чурилово,ФАП,FAP,"пер. Центральный, 2-2, 223402, д. Чурилово, Узденский р-н, Минская обл.",,53.506808,27.279212
2024,Чуховский ФАП,https://healthcare.by/instinfo.php?orgnum=17505,Чухово,ФАП,FAP,"ул. Советская, 35а, 225735, д. Чухово, Пинский р-н, Брестская обл.",,52.326408,26.259552
2025,Шалаевский ФАП,https://healthcare.by/instinfo.php?orgnum=16187,Шалаевка,ФАП,FAP,"ул. Центральная, 19, д. Шалаевка, Кировский р-н, Могилевская обл.",,53.505715,29.749642
2026,Шалыпский ФАП,https://healthcare.by/instinfo.php?orgnum=15868,Шалыпы,ФАП,FAP,"ул. Центральная, 1а, 247708, д. Шалыпы, Калинковичский р-н, Гомельская обл.",,52.223981,29.361696
2027,Шамовщинский ФАП,https://healthcare.by/instinfo.php?orgnum=16484,Шамовщина,ФАП,FAP,"213480, д. Шамовщина, Мстиславский р-н, Могилевская обл.",,54.04186,31.629043
2028,Шапковский ФАП,https://healthcare.by/instinfo.php?orgnum=17649,Юрцево,ФАП,FAP,"ул. Магистральная, 15, 211018, д. Юрцево, Оршанский р-н, Витебская обл.",,54.60415,30.366389
2029,Шапуровский ФАП,https://healthcare.by/instinfo.php?orgnum=15095,Шапурово,ФАП,FAP,"ул. Шоссейная, 19, д. Шапурово, Витебский р-н, Витебская обл.",http://vgcp.by,55.387479,30.742981
2030,Шапчицкий ФАП,https://healthcare.by/instinfo.php?orgnum=16171,Шапчицы,ФАП,FAP,"247262, д. Шапчицы, Рогачевский р-н, Гомельская обл.",,53.226525,30.357496
2031,Шапчицкий ФАП,https://healthcare.by/instinfo.php?orgnum=17022,Шапчицы,ФАП,FAP,"ул. Молодежная, 21, 222932, аг. Шапчицы, Стародорожский р-н, Минская обл.",,53.080639,28.233546
2032,Шараговский ФАП,https://healthcare.by/instinfo.php?orgnum=17645,Шараги,ФАП,FAP,"211945, д. Шараги, Миорский р-н, Витебская обл.",,55.559298,28.155833
2033,Шарибовский ФАП,https://healthcare.by/instinfo.php?orgnum=15656,Шарибовка,ФАП,FAP,"247356, д. Шарибовка, Буда-Кошелевский р-н, Гомельская обл.",,52.776934,30.536881
2034,Шарипский ФАП,https://healthcare.by/instinfo.php?orgnum=27221,Шарипы,ФАП,FAP,"ул. Ю. Гагарина, 2, 213405, д. Шарипы, Горецкий р-н, Могилевская обл.",,54.371805,30.894257
2035,Шароевский ФАП,https://healthcare.by/instinfo.php?orgnum=16738,Шароевка,ФАП,FAP,"213544, д. Шароевка, Чериковский р-н, Могилевская обл.",,53.633126,31.297331
2036,Шарпиловский ФАП,https://healthcare.by/instinfo.php?orgnum=15734,Шарпиловка,ФАП,FAP,"ул. 50 лет Октября, 39, 247000, д. Шарпиловка, Гомельский р-н, Гомельская обл.",,52.122743,30.926633
2037,Шеломовский ФАП,https://healthcare.by/instinfo.php?orgnum=16645,Шеломы,ФАП,FAP,"213245, д. Шеломы, Славгородский р-н, Могилевская обл.",,53.451259,30.883747
2038,Шелохановский ФАП,https://healthcare.by/instinfo.php?orgnum=16121,Шелохановка,ФАП,FAP,"213420, д. Шелохановка, Горецкий р-н, Могилевская обл.",,54.35463,31.035023
2039,Шеневской ФАП,https://healthcare.by/instinfo.php?orgnum=17370,Шени,ФАП,FAP,"ул. Молодежная, 2/1, 225170, д. Шени, Пружанский р-н, Брестская обл.",,52.528062,24.39377
2040,Шепелевский ФАП,https://healthcare.by/instinfo.php?orgnum=17072,Шепели,ФАП,FAP,"д. Шепели, Минский р-н, Минская обл.",,54.163401,27.497727
2041,Шерстинский ФАП,https://healthcare.by/instinfo.php?orgnum=15688,Шерстин,ФАП,FAP,"ул. Колхозная, 37, 247123, аг. Шерстин, Ветковский р-н, Гомельская обл.",,52.653897,31.058622
2042,Шибекский ФАП,https://healthcare.by/instinfo.php?orgnum=15297,Шибеки,ФАП,FAP,"211398, д. Шибеки, Оршанский р-н, Витебская обл.",,54.616033,29.960989
2043,Шиичский ФАП,https://healthcare.by/instinfo.php?orgnum=15861,Шиичи,ФАП,FAP,"ул. Шоссейная, 8, 247731, д. Шиичи, Калинковичский р-н, Гомельская обл.",,52.3141,29.445715
2044,Шилинский ФАП,https://healthcare.by/instinfo.php?orgnum=17219,Шилин,ФАП,FAP,"ул. Сов. Космонавтов, 4, 225220, д. Шилин, Березовский р-н, Брестская обл.",,52.447022,25.018772
2045,Шиловичский ФАП,https://healthcare.by/instinfo.php?orgnum=16532,Шиловичи,ФАП,FAP,"ул. Советская, 2, 231904, д. Шиловичи, Волковысский р-н, Гродненская обл.",,53.257925,24.441075
2046,Шиловичский ФАП,https://healthcare.by/instinfo.php?orgnum=17234,Шиловичи,ФАП,FAP,"ул. Гагарина, 16, д. Шиловичи, Вилейский р-н, Минская обл.",,54.478582,26.89105
2047,Шишевский ФАП,https://healthcare.by/instinfo.php?orgnum=16119,Шишево,ФАП,FAP,"213411, д. Шишево, Горецкий р-н, Могилевская обл.",,54.334539,30.961883
2048,Шишицкий ФАП,https://healthcare.by/instinfo.php?orgnum=17184,Шищицы,ФАП,FAP,"д. Шищицы, Слуцкий р-н, Минская обл.",,53.220109,27.544925
2049,Шищицкий ФАП,https://healthcare.by/instinfo.php?orgnum=26802,Шищицы,ФАП,FAP,"д. Шищицы, Слуцкий р-н, Минская обл.",,53.220109,27.544925
2050,Шкавской ФАП,https://healthcare.by/instinfo.php?orgnum=16003,Шкава,ФАП,FAP,"ул. Юбилейная, 1, 247314, д. Шкава, Октябрьский р-н, Гомельская обл.",,52.696312,29.00228
2051,Шкунтиковский ФАП,https://healthcare.by/instinfo.php?orgnum=15503,Шкунтики,ФАП,FAP,"211923, д. Шкунтики, Шарковщинский р-н, Витебская обл.",,55.369152,27.672153
2052,Шпаковщинский ФАП,https://healthcare.by/instinfo.php?orgnum=15313,Шпаковщина,ФАП,FAP,"Шпаковщинский с/с, ул. Школьная, 1, 211439, д. Шпаковщина, Полоцкий р-н, Витебская обл.",,55.471342,28.330241
2053,Шумаковский ФАП,https://healthcare.by/instinfo.php?orgnum=17605,Шумаки,ФАП,FAP,"ул. Речная, 16, 225037, д. Шумаки, Брестский р-н, Брестская обл.",,52.159509,23.544511
2054,Шуневичский ФАП,https://healthcare.by/instinfo.php?orgnum=15187,Шуневичи,ФАП,FAP,"211820, д. Шуневичи, Глубокский р-н, Витебская обл.",,55.095884,27.704142
2055,Шуневский ФАП,https://healthcare.by/instinfo.php?orgnum=17597,Шунево,ФАП,FAP,"211801, д. Шуневцы, Глубокский р-н, Витебская обл.",,55.150257,27.625818
2056,Щатковский ФАП,https://healthcare.by/instinfo.php?orgnum=16329,Шатково,ФАП,FAP,"213849, д. Шатково, Бобруйский р-н, Могилевская обл.",,53.036065,29.239579
2057,Щепичский ФАП,https://healthcare.by/instinfo.php?orgnum=14970,Щепичи,ФАП,FAP,"ул. Советская, 44, 222535, д. Щепичи, Клецкий р-н, Минская обл.",,53.075224,26.576218
2058,Щерчевский ФАП,https://healthcare.by/instinfo.php?orgnum=17373,Щерчево,ФАП,FAP,"ул. Чередниченско, 4, 225173, д. Щерчево, Пружанский р-н, Брестская обл.",,52.421557,24.167735
