,facility_title,link,settlement,facility_type,facility_type_eng,address,website,latitude,longitude
978,Лукьяновичский ФАП,https://healthcare.by/instinfo.php?orgnum=14879,Лукьяновичи,ФАП,FAP,"д. Лукьяновичи, Мядельский р-н, Минская обл.",,54.851454,27.009008
979,Лутковский ФАП,https://healthcare.by/instinfo.php?orgnum=21598,Лутки,ФАП,FAP,"ул. Молодежная, 1а, 225555, д. Лутки, Столинский р-н, Брестская обл.",,52.030039,27.588313
980,Лутовский ФАП,https://healthcare.by/instinfo.php?orgnum=16414,Луты,ФАП,FAP,"213513, д. Луты, Кричевский р-н, Могилевская обл.",,53.816462,31.579941
981,Лучайский ФАП,https://healthcare.by/instinfo.php?orgnum=15362,Лучай,ФАП,FAP,"211875, д. Лучай, Поставский р-н, Витебская обл.",,55.090706,27.117857
982,Лучайский ФАП,https://healthcare.by/instinfo.php?orgnum=17595,Лучайно,ФАП,FAP,"211803, д. Лучайка, Глубокский р-н, Витебская обл.",,55.287358,27.771561
983,Лучежевичский ФАП,https://healthcare.by/instinfo.php?orgnum=16326,Лучежевичи,ФАП,FAP,"ул. Крупской, 1, 247762, д. Лучежевичи, Мозырский р-н, Гомельская обл.",,52.093449,29.176283
984,Лучезарненский ФАП,https://healthcare.by/instinfo.php?orgnum=15422,Лучезарное,ФАП,FAP,"д. Лучезарная, Сенненский р-н, Витебская обл.",,54.808872,29.908096
985,Лучинский ФАП,https://healthcare.by/instinfo.php?orgnum=16150,Лучин,ФАП,FAP,"247280, д. Лучин, Рогачевский р-н, Гомельская обл.",,53.116633,30.223926
986,Лучский ФАП,https://healthcare.by/instinfo.php?orgnum=25664,Луч,ФАП,FAP,"ул. Парковая, 1, 223233, д. Луч, Червенский р-н, Минская обл.",,53.614546,28.763894
987,Лыковский ФАП,https://healthcare.by/instinfo.php?orgnum=16460,Лыково,ФАП,FAP,"ул. Центральная, 8, 213151, п. Мирный, Могилевский р-н, Могилевская обл.",,53.756792,30.369542
988,Лысицкий ФАП,https://healthcare.by/instinfo.php?orgnum=14923,Большая Лысица,ФАП,FAP,"д. Большая Лысица, Несвижский р-н, Минская обл.",,53.307735,26.454577
989,Лыцевичский ФАП,https://healthcare.by/instinfo.php?orgnum=17229,Лыцевичи,ФАП,FAP,"ул. Молодежная, 3, аг. Лыцевичи, Вилейский р-н, Минская обл.",,54.713392,26.638911
990,Лыщенский ФАП,https://healthcare.by/instinfo.php?orgnum=17499,Лыще,ФАП,FAP,"ул. Чекана, 32, 225741, д. Лыще, Пинский р-н, Брестская обл.",,52.365436,26.144227
991,Льнозаводской ФАП,https://healthcare.by/instinfo.php?orgnum=15320,Коллективное,ФАП,FAP,"211413, пос. Коллективное, Полоцкий р-н, Витебская обл.",,55.533934,28.898722
992,Льнозаводской ФАП,https://healthcare.by/instinfo.php?orgnum=15345,Ленок,ФАП,FAP,"д. Ленок, Крупский р-н, Минская обл.",,54.301238,29.010544
993,Любанский ФАП,https://healthcare.by/instinfo.php?orgnum=12129,Любань,ФАП,FAP,"ул. Жукова, 3а, 247303, д. Любань, Октябрьский р-н, Гомельская обл.",,52.601093,29.134718
994,Любиничский ФАП,https://healthcare.by/instinfo.php?orgnum=16801,Любиничи,ФАП,FAP,"ул. Садовая, 10, 213012, д. Любиничи, Шкловский р-н, Могилевская обл.",,54.235969,30.456032
995,Любишинский ФАП,https://healthcare.by/instinfo.php?orgnum=14863,Любишино,ФАП,FAP,"ул. Спортивная, д. 5, 223225, аг. Любишино, Червенский р-н, Минская обл.",,53.749636,28.494471
996,Любищицкий ФАП,https://healthcare.by/instinfo.php?orgnum=17840,Любищицы,ФАП,FAP,"д. Любищицы, Ивацевичский р-н, Брестская обл.",,52.752386,25.412396
997,Любковщинская амбулатория,https://healthcare.by/instinfo.php?orgnum=16951,Любковщина,Амбулатория,Outpatient Clinic,"ул. Юбилейная, 1, 222697, аг. Любковщина, Столбцовский р-н, Минская обл.",,53.346376,26.792801
998,Любушанский ФАП,https://healthcare.by/instinfo.php?orgnum=15543,Любушаны,ФАП,FAP,"ул. Новая, 20, 223329, д. Любушаны, Березинский р-н, Минская обл.",,53.799076,29.226113
999,Любячский ФАП,https://healthcare.by/instinfo.php?orgnum=16854,Любяча,ФАП,FAP,"ул. Центральная, 131, 223414, д. Любяча, Узденский р-н, Минская обл.",,53.433495,27.552372
1000,Лютнянский ФАП,https://healthcare.by/instinfo.php?orgnum=16481,Лютня,ФАП,FAP,"213456, д. Лютня, Мстиславский р-н, Могилевская обл.",,54.047538,31.685188
1001,Люшневский ФАП,https://healthcare.by/instinfo.php?orgnum=17722,Люшнево,ФАП,FAP,"ул. Встречная, 146, 225338, д. Люшнево, Барановичский р-н, Брестская обл.",,53.237084,25.712721
1002,Лющанский ФАП,https://healthcare.by/instinfo.php?orgnum=18110,Люща,ФАП,FAP,"ул. Зеленая, 1, 225683, д. Люща, Лунинецкий р-н, Брестская обл.",,52.450617,26.710803
1003,Лядненский ФАП,https://healthcare.by/instinfo.php?orgnum=17624,Лядно,ФАП,FAP,"211197, д. Лядно, Лепельский р-н, Витебская обл.",,54.915062,28.718367
1004,Ляднянский ФАП,https://healthcare.by/instinfo.php?orgnum=15228,Ляды,ФАП,FAP,"ул. Центральная, 1, 211059, д. Ляды, Дубровенский р-н, Витебская обл.",,54.635845,31.023399
1005,Ляховичский ФАП,https://healthcare.by/instinfo.php?orgnum=17762,Ляховичи,ФАП,FAP,"ул. Жукова, 14, 225617, д. Ляховичи, Дрогичинский р-н, Брестская обл.",,52.060272,25.127819
1006,Ляховичский ФАП,https://healthcare.by/instinfo.php?orgnum=17296,Ляховичи,ФАП,FAP,"ул. Новая, 30а, д. Ляховичи, Дзержинский р-н, Минская обл.",,53.618793,27.189848
1007,Ляховский ФАП,https://healthcare.by/instinfo.php?orgnum=15378,Ляховка,ФАП,FAP,"ул. Солнечная, 16, 223818, д. Ляховка, Любанский р-н, Минская обл.",,52.688196,27.906497
1008,"Ляховщинский ФАП, ФАП",https://healthcare.by/instinfo.php?orgnum=30212,Ляховщина,ФАП,FAP,"211875, д. Ляховщина, Поставский р-н, Витебская обл.",,55.137996,27.335572
1009,М. Берестовицкая амбулатория,https://healthcare.by/instinfo.php?orgnum=16451,Малая Берестовица,Амбулатория,Outpatient Clinic,"231780, д. Малая Берестовица, Берестовицкий р-н, Гродненская обл.",,53.288248,23.930787
1010,М. Дубравский ФАП,https://healthcare.by/instinfo.php?orgnum=17501,Мокрая Дубрава,ФАП,FAP,"ул. Красноармейская, 30, 225721, д. Мокрая Дубрава, Пинский р-н, Брестская обл.",,52.345338,26.067555
1011,М. Плотницкий ФАП,https://healthcare.by/instinfo.php?orgnum=17506,Малая Плотница,ФАП,FAP,"ул. Первомайская, 38, 225719, д. Малая Плотница, Пинский р-н, Брестская обл.",,52.465011,26.408816
1012,Магдалинский ФАП,https://healthcare.by/instinfo.php?orgnum=18065,Магдалин,ФАП,FAP,"ул. Киселевецкая, 2а, 225860, д. Магдалин, Кобринский р-н, Брестская обл.",,52.193518,24.393437
1013,Магеровский ФАП,https://healthcare.by/instinfo.php?orgnum=15291,Магеровка,ФАП,FAP,"211036, д. Магеровка, Оршанский р-н, Витебская обл.",,54.364588,30.478894
1014,Мадорский ФАП,https://healthcare.by/instinfo.php?orgnum=16151,Мадора,ФАП,FAP,"247253, д. Мадора, Рогачевский р-н, Гомельская обл.",,53.142535,30.184561
1015,Мазоловский ФАП,https://healthcare.by/instinfo.php?orgnum=17973,Мазолово,ФАП,FAP,"213477, д. Мазолово, Мстиславский р-н, Могилевская обл.",,53.980892,31.582798
1016,Мазурщинский ФАП,https://healthcare.by/instinfo.php?orgnum=17335,Мазурщина,ФАП,FAP,"ул. Центральная, 33, 223719, д. Мазурщина, Солигорский р-н, Минская обл.",,52.643068,27.517481
1017,Майзоровский ФАП,https://healthcare.by/instinfo.php?orgnum=14864,Майзорово,ФАП,FAP,"ул. Народная, д. 1, 223225, д. Майзорово, Червенский р-н, Минская обл.",,53.648265,28.470369
1018,Майский ФАП,https://healthcare.by/instinfo.php?orgnum=17841,Майск,ФАП,FAP,"д. Майск, Ивацевичский р-н, Брестская обл.",,52.715661,25.445553
1019,Майский ФАП,https://healthcare.by/instinfo.php?orgnum=16743,Майский,ФАП,FAP,"213534, п. Майский, Чериковский р-н, Могилевская обл.",,53.597493,31.394763
1020,Макаренский ФАП,https://healthcare.by/instinfo.php?orgnum=17934,Макаренцы,ФАП,FAP,"ул. Школьная, 17, 213115, д. Макаренцы, Могилевский р-н, Могилевская обл.",,53.975226,30.513102
1021,Макаричиский ФАП,https://healthcare.by/instinfo.php?orgnum=16029,Макаричи,ФАП,FAP,"247943, д. Макаричи, Петриковский р-н, Гомельская обл.",,52.103662,28.425444
1022,Макаричский ФАП,https://healthcare.by/instinfo.php?orgnum=27184,Макаричи,ФАП,FAP,"ул. Школьная, 10б, 247932, д. Макаричи, Стародорожский р-н, Минская обл.",,52.97601,28.321518
1023,Макеевичский ФАП,https://healthcare.by/instinfo.php?orgnum=16262,Макеевичи,ФАП,FAP,"213617, д. Макеевичи, Климовичский р-н, Могилевская обл.",,53.680858,32.404011
1024,Маковский ФАП,https://healthcare.by/instinfo.php?orgnum=17737,Маково,ФАП,FAP,"пер. Школьный, 2, д. Маково, Ганцевичский р-н, Брестская обл.",,52.628536,26.568115
1025,Маковский ФАП,https://healthcare.by/instinfo.php?orgnum=15712,Маковье,ФАП,FAP,"ул. Советская, 27, 247022, д. Маковье, Гомельский р-н, Гомельская обл.",,52.155443,31.256332
1026,Максимовичский ФАП,https://healthcare.by/instinfo.php?orgnum=17893,Максимовичи,ФАП,FAP,"213909, д. Максимовичи, Кличевский р-н, Могилевская обл.",,53.599448,29.128232
1027,Малашковичская амбулатория врача общей практики,https://healthcare.by/instinfo.php?orgnum=17884,Малашковичи,Амбулатория,Outpatient Clinic,"213623, д. Малышковичи, Климовичский р-н, Могилевская обл.",,53.524878,32.271204
1028,Малевичский ФАП,https://healthcare.by/instinfo.php?orgnum=15816,Малевичи,ФАП,FAP,"ул. Советская, 42а, 247230, д. Малевичи, Жлобинский р-н, Гомельская обл.",,52.811408,29.936069
1029,Малейковский ФАП,https://healthcare.by/instinfo.php?orgnum=22881,Селец,ФАП,FAP,"ул. Зеленая, 8, 247640, д. Селец, Брагинский р-н, Гомельская обл.",,51.82277,30.326477
1030,Малиновский ФАП,https://healthcare.by/instinfo.php?orgnum=17766,Малиновка,ФАП,FAP,"ул. Советская, 7, 225840, д. Малиновка, Дрогичинский р-н, Брестская обл.",,52.017105,25.240297
1031,Малиновский ФАП,https://healthcare.by/instinfo.php?orgnum=15964,Малиновка,ФАП,FAP,"247104, ул. Мира, 2, д. Малиновка, Лоевский р-н, Гомельская обл.",,52.026693,30.706698
1032,Малиновщинский ФАП,https://healthcare.by/instinfo.php?orgnum=15198,Малиновщина,ФАП,FAP,"ул. Центральная, 20, 222315, д. Малиновщина, Молодеченский р-н, Минская обл.",,54.329504,26.654847
1033,Малишевский ФАП,https://healthcare.by/instinfo.php?orgnum=15805,Малишев,ФАП,FAP,"ул. Центральная, 19, 247987, д. Малишев, Житковичский р-н, Гомельская обл.",,52.052602,28.043687
1034,Мало-Автюковский ФАП,https://healthcare.by/instinfo.php?orgnum=15864,Малые Автюки,ФАП,FAP,"ул. Школьная, 1А, 2477, д. Малые Автюки, Калинковичский р-н, Гомельская обл.",,52.132479,29.507465
1035,Мало-Зводский ФАП,https://healthcare.by/instinfo.php?orgnum=17589,Малые Зводы,ФАП,FAP,"ул. Молодежная, 2, 225070, д. Малые Зводы, Брестский р-н, Брестская обл.",,52.304018,23.480003
1036,Мало-Лапеницкий ФАП,https://healthcare.by/instinfo.php?orgnum=16519,Малая Лапеница,ФАП,FAP,"ул. Изабелинская, 13, 231926, д. Малая Лапеница, Волковысский р-н, Гродненская обл.",,53.029058,24.493222
1037,Мало-Немковский ФАП,https://healthcare.by/instinfo.php?orgnum=15695,Малые Немки,ФАП,FAP,"247135, ул. Молодежная, 4, д. Малые Немки, Ветковский р-н, Гомельская обл.",,52.860673,31.365361
1038,Мало-Осовецкий ФАП,https://healthcare.by/instinfo.php?orgnum=16440,Малый Осовец,ФАП,FAP,"ул. 2-я Малая Осовецкая, 16, 213103, д. Малый Осовец, Могилевский р-н, Могилевская обл.",,53.686308,30.555835
1039,Мало-Чучевичский ФАП,https://healthcare.by/instinfo.php?orgnum=18124,Малые Чучевичи,ФАП,FAP,"ул. Ленина, 27а, 225683, д. Малые Чучевичи, Лунинецкий р-н, Брестская обл.",,52.593528,26.887583
1040,Малогородищенский ФАП,https://healthcare.by/instinfo.php?orgnum=18087,Малое Городище,ФАП,FAP,"ул. Советская, 21/2, 225382, д. Малое Городище, Ляховичский р-н, Брестская обл.",,53.082635,26.354873
1041,Малодолецкий ФАП,https://healthcare.by/instinfo.php?orgnum=15464,Малые Дольцы,ФАП,FAP,"211485, Великодолецкий с/с, д. Малые Дольцы, Ушачский р-н, Витебская обл.",,54.985674,28.385865
1042,Малодушский ФАП,https://healthcare.by/instinfo.php?orgnum=16105,Малодуша,ФАП,FAP,"ул. Советская, 31а, 247563, д. Малодуша, Речицкий р-н, Гомельская обл.",,52.157156,30.24827
1043,Малосворотовский ФАП,https://healthcare.by/instinfo.php?orgnum=17712,Малая Своротва,ФАП,FAP,"ул. Вильчковского, 2е, 225335, д. Малая Своротва, Барановичский р-н, Брестская обл.",,53.364176,25.699525
1044,Малоситнянский ФАП,https://healthcare.by/instinfo.php?orgnum=15323,Малое Ситно,ФАП,FAP,"ул. Молодежная, 3, 211652, д. Малое Ситно, Полоцкий р-н, Витебская обл.",,55.695413,29.353036
1045,Мальковичский ФАП,https://healthcare.by/instinfo.php?orgnum=16686,Мальковичи,ФАП,FAP,"ул. 1-ое Мая, д. Мальковичи, Мостовский р-н, Гродненская обл.",,53.393677,24.807605
1046,Малюшичский ФАП,https://healthcare.by/instinfo.php?orgnum=16736,Малюшичи,ФАП,FAP,"д. Малюшичи, Кореличский р-н, Гродненская обл.",,53.488735,26.071787
1047,Маньковщинский ФАП,https://healthcare.by/instinfo.php?orgnum=17203,Маньковщина,ФАП,FAP,"д. Маньковщина, Воложинский р-н, Минская обл.",,54.018733,26.863184
1048,Марковичский ФАП,https://healthcare.by/instinfo.php?orgnum=17765,Марковичи,ФАП,FAP,"ул. Ленина, 17, 225839, д. Марковичи, Дрогичинский р-н, Брестская обл.",,52.356384,25.116698
1049,Марковский ФАП,https://healthcare.by/instinfo.php?orgnum=15939,Марковское,ФАП,FAP,"ул. Набережная, 11, 247845, д. Марковское, Лельчицкий р-н, Гомельская обл.",,51.723103,28.208915
1050,Мархачевщинский ФАП,https://healthcare.by/instinfo.php?orgnum=16952,Мархачевщина,ФАП,FAP,"ул. Центральная, 76, 222699, д. Мархачевщина, Столбцовский р-н, Минская обл.",,53.411511,26.714504
1051,Марьинский ФАП,https://healthcare.by/instinfo.php?orgnum=15735,Марьинка,ФАП,FAP,"ул. Советская, 29, 247056, д. Марьинка, Добрушский р-н, Гомельская обл.",,52.346174,31.442266
1052,Масевичский ФАП,https://healthcare.by/instinfo.php?orgnum=17452,Масевичи,ФАП,FAP,"ул. Завьялова, д. 116, 225913, д. Масевичи, Малоритский р-н, Брестская обл.",,51.944732,23.961797
1053,Массолянский ФАП,https://healthcare.by/instinfo.php?orgnum=16473,Массоляны,ФАП,FAP,"231781, д. Массоляны, Берестовицкий р-н, Гродненская обл.",,53.352364,24.018983
1054,Матеевичский ФАП,https://healthcare.by/instinfo.php?orgnum=24163,Матеевичи,ФАП,FAP,"ул. Центральная, 225128, д. Матеевичи, Жабинковский р-н, Брестская обл.",,52.218674,24.027517
1055,Матыринский ФАП,https://healthcare.by/instinfo.php?orgnum=15622,Матырино,ФАП,FAP,"211198, д. Матырино, Лепельский р-н, Витебская обл.",,54.958301,28.937017
1056,Матыринский ФАП,https://healthcare.by/instinfo.php?orgnum=15465,Матырино,ФАП,FAP,"Ушачский с/с, ул. Центральная, 44, 211489, д. Матырино, Ушачский р-н, Витебская обл.",,55.243207,28.543106
1057,Матюковский ФАП,https://healthcare.by/instinfo.php?orgnum=17596,Матюково,ФАП,FAP,"211825, д. Матюково, Глубокский р-н, Витебская обл.",,55.264173,28.013297
1058,Матютский ФАП,https://healthcare.by/instinfo.php?orgnum=16124,Матюты,ФАП,FAP,"ул. Цветочная, 23, 213414, д. Матюты, Горецкий р-н, Могилевская обл.",,54.257049,30.909699
1059,Махновичский ФАП,https://healthcare.by/instinfo.php?orgnum=16285,Махновичи,ФАП,FAP,"ул. Советская, 11, 247759, д. Махновичи, Мозырский р-н, Гомельская обл.",,52.060986,29.236695
1060,Махновичский ФАП,https://healthcare.by/instinfo.php?orgnum=17337,Махновичи,ФАП,FAP,"ул. Колхозная, 12, 223740, д. Махновичи, Солигорский р-н, Минская обл.",,52.614945,27.625629
1061,Маческий ФАП,https://healthcare.by/instinfo.php?orgnum=15544,Маческ,ФАП,FAP,"ул. Школьная, 32, 223322, д. Маческ, Березинский р-н, Минская обл.",,53.821018,29.313833
1062,Машковский ФАП,https://healthcare.by/instinfo.php?orgnum=15290,Корево,ФАП,FAP,"ул. Центральная, 20а, 211013, д. Мошково, Оршанский р-н, Витебская обл.",,54.563995,30.27336
1063,Маякский ФАП,https://healthcare.by/instinfo.php?orgnum=17159,Маяк,ФАП,FAP,"ул. Школьная, 15, 223647, д. Маяк, Слуцкий р-н, Минская обл.",,53.12576,27.456189
1064,Меденевичский ФАП,https://healthcare.by/instinfo.php?orgnum=17666,Меденевичи,ФАП,FAP,"223513, д. Меденевичи, Барановичский р-н, Брестская обл.",,53.289862,26.078183
1065,Межанский ФАП,https://healthcare.by/instinfo.php?orgnum=15113,Межаны,ФАП,FAP,"ул. Школьная, 1, 211982, д. Межаны, Браславский р-н, Витебская обл.",,55.64131,27.035589
1066,Межлесский ФАП,https://healthcare.by/instinfo.php?orgnum=3357,Межлесье,ФАП,FAP,"ул. Партизанская, 6, 225681, д. Межлесье, Лунинецкий р-н, Брестская обл.",,52.214911,26.95121
1067,Межниковский ФАП,https://healthcare.by/instinfo.php?orgnum=17859,Межнин,ФАП,FAP,"ул. Советская, 4, 213000, д. Межнин, Шкловский р-н, Могилевская обл.",,54.322101,30.247821
1068,Мелькановичский ФАП,https://healthcare.by/instinfo.php?orgnum=17044,Мелькановичи,ФАП,FAP,"231803, д. Мелькановичи, Слонимский р-н, Гродненская обл.",,53.048274,25.159916
1069,Мельникский ФАП,https://healthcare.by/instinfo.php?orgnum=17447,Мельники,ФАП,FAP,"ул. Интернациональная, 38 а, 225927, д. Мельники, Малоритский р-н, Брестская обл.",,51.736631,24.1267
1070,Меляховичский ФАП,https://healthcare.by/instinfo.php?orgnum=17265,Белогурна,ФАП,FAP,"231475, д. Белогурна, Дятловский р-н, Гродненская обл.",,53.441788,25.398086
1071,Мерецковский ФАП,https://healthcare.by/instinfo.php?orgnum=15200,Мерецкие,ФАП,FAP,"211809, д. Мерецкие, Глубокский р-н, Витебская обл.",,55.196438,27.631819
1072,Мерчицкий ФАП,https://healthcare.by/instinfo.php?orgnum=17479,Мерчицы,ФАП,FAP,"ул. Полесская, 61, 225754, д. Мерчицы, Пинский р-н, Брестская обл.",,52.261198,25.936788
1073,Микелевщинский ФАП,https://healthcare.by/instinfo.php?orgnum=16688,Микелевщина,ФАП,FAP,"ул. Мира, 56, 231611, д. Микелевщина, Мостовский р-н, Гродненская обл.",,53.491548,24.667181
1074,Микуличский ФАП,https://healthcare.by/instinfo.php?orgnum=15540,Микуличи,ФАП,FAP,"ул. Мира, 9, 223341, д. Микуличи, Березинский р-н, Минская обл.",,53.834708,28.78972
1075,Милашковский ФАП,https://healthcare.by/instinfo.php?orgnum=17575,Малашни,ФАП,FAP,"д. Милашки, Браславский р-н, Витебская обл.",,55.452064,26.998632
1076,Милевичский ФАП,https://healthcare.by/instinfo.php?orgnum=15793,Милевичи,ФАП,FAP,"ул. Первомайская, 12, 247976, д. Милевичи, Житковичский р-н, Гомельская обл.",,52.466048,27.601887
1077,Милейковский ФАП,https://healthcare.by/instinfo.php?orgnum=17867,Милейки,ФАП,FAP,"д. Милейки, Ивацевичский р-н, Брестская обл.",,52.67387,25.549614
1078,Милейковский ФАП,https://healthcare.by/instinfo.php?orgnum=16571,Милейково,ФАП,FAP,"213489, д. Милейково, Мстиславский р-н, Могилевская обл.",,54.132403,31.521533
1079,Мильковский ФАП,https://healthcare.by/instinfo.php?orgnum=15114,Дирничи,ФАП,FAP,"ул. Советская, 1, 211975, д. Мильки, Браславский р-н, Витебская обл.",,55.543002,26.833172
1080,Мильковщинский ФАП,https://healthcare.by/instinfo.php?orgnum=16630,Мильковщина,ФАП,FAP,"231764, д. Мильковщина, ул. Олежко, 3, Гродненский р-н, Гродненская обл.",,53.559476,24.394075
1081,Мильчанский ФАП,https://healthcare.by/instinfo.php?orgnum=17236,Мильча,ФАП,FAP,"ул. Школьная, 1, д. Мильча, Вилейский р-н, Минская обл.",,54.68116,27.616664
1082,Минковичский ФАП,https://healthcare.by/instinfo.php?orgnum=17013,Минковичи,ФАП,FAP,"222912, ул. Центральная, 11, д. Минковичи, Стародорожский р-н, Минская обл.",,53.0129,28.501361
1083,Миратичский ФАП,https://healthcare.by/instinfo.php?orgnum=16739,Миратичи,ФАП,FAP,"231452, д. Миратичи, Кореличский р-н, Гродненская обл.",,53.455479,25.948942
